symbol,company_name,company
SEA,Tong Cong ty Thuy san Viet Nam - Cong ty Co phan,SEA - Tong Cong ty Thuy san Viet Nam - Cong ty Co phan
SPV,Cong ty Co phan Thuy Dac San,SPV - Cong ty Co phan Thuy Dac San
SEB,Cong ty Co phan Dau tu va Phat trien Dien Mien Trung,SEB - Cong ty Co phan Dau tu va Phat trien Dien Mien Trung
SED,Cong ty Co phan Dau tu va Phat trien Giao duc Phuong Nam,SED - Cong ty Co phan Dau tu va Phat trien Giao duc Phuong Nam
SEP,Cong ty Co phan Tong Cong ty Thuong mai Quang Tri,SEP - Cong ty Co phan Tong Cong ty Thuong mai Quang Tri
SFC,Cong ty Co phan Nhien lieu Sai Gon,SFC - Cong ty Co phan Nhien lieu Sai Gon
SFG,Cong ty Co phan Phan bon Mien Nam,SFG - Cong ty Co phan Phan bon Mien Nam
SFI,Cong ty Co phan Dai ly Van tai SAFI,SFI - Cong ty Co phan Dai ly Van tai SAFI
SFN,Cong ty Co phan Det luoi Sai Gon,SFN - Cong ty Co phan Det luoi Sai Gon
SGB,Ngan hang Thuong mai Co phan Sai Gon Cong thuong,SGB - Ngan hang Thuong mai Co phan Sai Gon Cong thuong
BSG,Cong ty Co phan Xe khach Sai Gon,BSG - Cong ty Co phan Xe khach Sai Gon
SGC,Cong ty Co phan Xuat nhap khau Sa Giang,SGC - Cong ty Co phan Xuat nhap khau Sa Giang
SGD,Cong ty Co phan Sach Giao duc tai Thanh pho Ho Chi Minh,SGD - Cong ty Co phan Sach Giao duc tai Thanh pho Ho Chi Minh
SGH,Cong ty Co phan Khach san Sai Gon,SGH - Cong ty Co phan Khach san Sai Gon
SGO,Cong ty Co phan Dau thuc vat Sai Gon,SGO - Cong ty Co phan Dau thuc vat Sai Gon
NSG,Cong ty Co phan Nhua Sai Gon,NSG - Cong ty Co phan Nhua Sai Gon
SGR,Cong ty Co phan Tong Cong ty Co phan Dia oc Sai Gon,SGR - Cong ty Co phan Tong Cong ty Co phan Dia oc Sai Gon
SRT,Cong ty Co phan Van tai Duong sat Sai Gon,SRT - Cong ty Co phan Van tai Duong sat Sai Gon
SGS,Cong ty Co phan Van tai bien Sai Gon,SGS - Cong ty Co phan Van tai bien Sai Gon
SGT,Cong ty Co phan Cong nghe Vien thong Sai Gon,SGT - Cong ty Co phan Cong nghe Vien thong Sai Gon
SIP,Cong ty Co phan Dau tu Sai Gon VRG,SIP - Cong ty Co phan Dau tu Sai Gon VRG
TPS,Cong ty Co phan Ben bai van tai Sai Gon,TPS - Cong ty Co phan Ben bai van tai Sai Gon
SHA,Cong ty Co phan Son Ha Sai Gon,SHA - Cong ty Co phan Son Ha Sai Gon
NSH,Cong ty Co phan Tap doan Nhom Song Hong Shalumi,NSH - Cong ty Co phan Tap doan Nhom Song Hong Shalumi
SHB,Ngan hang Thuong mai Co phan Sai Gon – Ha N,SHB - Ngan hang Thuong mai Co phan Sai Gon – Ha N
SHC,Cong ty Co phan Hang hai Sai Gon,SHC - Cong ty Co phan Hang hai Sai Gon
SHG,Tong Cong ty Co phan Song Hong,SHG - Tong Cong ty Co phan Song Hong
MSH,Cong ty Co phan May Song Hong,MSH - Cong ty Co phan May Song Hong
SHI,Cong ty Co phan Quoc te Son Ha,SHI - Cong ty Co phan Quoc te Son Ha
SHN,Cong ty Co phan Dau tu Tong hop Ha Noi,SHN - Cong ty Co phan Dau tu Tong hop Ha Noi
SHP,Cong ty Co phan Thuy dien Mien Nam,SHP - Cong ty Co phan Thuy dien Mien Nam
SHS,Cong ty Co phan Chung khoan Sai Gon - Ha Noi,SHS - Cong ty Co phan Chung khoan Sai Gon - Ha Noi
SHX,Cong ty Co phan Sai Gon Hoa xa,SHX - Cong ty Co phan Sai Gon Hoa xa
SBV,Cong ty Co phan Siam Brothers Viet Nam,SBV - Cong ty Co phan Siam Brothers Viet Nam
SIC,Cong ty Co phan ANI,SIC - Cong ty Co phan ANI
SZC,Cong ty Co phan Sonadezi Chau Duc,SZC - Cong ty Co phan Sonadezi Chau Duc
SII,Cong ty Co phan Ha tang Nuoc Sai Gon,SII - Cong ty Co phan Ha tang Nuoc Sai Gon
SIV,Cong ty Co phan SIVICO,SIV - Cong ty Co phan SIVICO
SJ1,Cong ty Co phan Nong nghiep Hung Hau,SJ1 - Cong ty Co phan Nong nghiep Hung Hau
SJC,Cong ty Co phan Song Da 1.01,SJC - Cong ty Co phan Song Da 1.01
SJD,Cong ty Co phan Thuy dien Can Don,SJD - Cong ty Co phan Thuy dien Can Don
SJE,Cong ty Co phan Song Da 11,SJE - Cong ty Co phan Song Da 11
SJF,Cong ty Co phan Dau tu Sao Thai Duong,SJF - Cong ty Co phan Dau tu Sao Thai Duong
SJM,Cong ty Co phan Song Da 19,SJM - Cong ty Co phan Song Da 19
SJS,Cong ty Co phan Dau tu Phat trien Do thi va Khu cong nghiep Song Da,SJS - Cong ty Co phan Dau tu Phat trien Do thi va Khu cong nghiep Song Da
SKG,Cong ty Co phan Tau Cao toc Superdong - Kien Giang,SKG - Cong ty Co phan Tau Cao toc Superdong - Kien Giang
SKN,Cong ty Co phan Nuoc giai khat Sanna Khanh Hoa,SKN - Cong ty Co phan Nuoc giai khat Sanna Khanh Hoa
SLS,Cong ty Co phan Mia duong Son La,SLS - Cong ty Co phan Mia duong Son La
SMA,Cong ty Co phan Thiet bi Phu tung Sai Gon,SMA - Cong ty Co phan Thiet bi Phu tung Sai Gon
SMB,Cong ty Co phan Bia Sai Gon - Mien Trung,SMB - Cong ty Co phan Bia Sai Gon - Mien Trung
SMC,Cong ty Co phan Dau tu Thuong mai SMC,SMC - Cong ty Co phan Dau tu Thuong mai SMC
SMT,Cong ty Co phan SAMETEL,SMT - Cong ty Co phan SAMETEL
SNC,Cong ty Co phan Xuat nhap khau Thuy san Nam Can,SNC - Cong ty Co phan Xuat nhap khau Thuy san Nam Can
SMN,Cong ty Co phan Sach va thiet bi giao duc Mien Nam,SMN - Cong ty Co phan Sach va thiet bi giao duc Mien Nam
SIG,Cong ty Co phan Dau tu va Thuong mai Song Da,SIG - Cong ty Co phan Dau tu va Thuong mai Song Da
SNZ,Tong Cong ty Co phan Phat trien Khu Cong nghiep,SNZ - Tong Cong ty Co phan Phat trien Khu Cong nghiep
SZG,Cong ty Co phan Sonadezi Giang Dien,SZG - Cong ty Co phan Sonadezi Giang Dien
SJG,Tong Cong ty Song Da,SJG - Tong Cong ty Song Da
SHE,Cong ty Co phan Phat trien Nang Luong Son Ha,SHE - Cong ty Co phan Phat trien Nang Luong Son Ha
SBR,Cong ty Co phan Cao su Song Be,SBR - Cong ty Co phan Cao su Song Be
NSL,Cong ty Co phan Cap nuoc Son La,NSL - Cong ty Co phan Cap nuoc Son La
SPB,Cong ty Co phan Soi Phu Bai,SPB - Cong ty Co phan Soi Phu Bai
SPC,Cong ty Co phan Bao ve Thuc vat Sai Gon,SPC - Cong ty Co phan Bao ve Thuc vat Sai Gon
SPD,Cong ty Co phan Xuat nhap khau Thuy san Mien Trung,SPD - Cong ty Co phan Xuat nhap khau Thuy san Mien Trung
SPH,Cong ty Co phan Xuat Nhap khau Thuy san Ha Noi,SPH - Cong ty Co phan Xuat Nhap khau Thuy san Ha Noi
SP2,Cong ty Co phan Thuy dien Su Pan 2,SP2 - Cong ty Co phan Thuy dien Su Pan 2
SPI,Cong ty Co phan Spiral Galaxy,SPI - Cong ty Co phan Spiral Galaxy
SPM,Cong ty Co phan S.P.M,SPM - Cong ty Co phan S.P.M
ISH,Cong ty Co phan Thuy dien Srok Phu Mieng IDICO,ISH - Cong ty Co phan Thuy dien Srok Phu Mieng IDICO
SPP,Cong ty Co phan Bao bi Nhua Sai Gon,SPP - Cong ty Co phan Bao bi Nhua Sai Gon
SQC,Cong ty Co phan Khoang san Sai Gon - Quy Nhon,SQC - Cong ty Co phan Khoang san Sai Gon - Quy Nhon
SRA,Cong ty Co phan SARA Viet Nam,SRA - Cong ty Co phan SARA Viet Nam
SRB,Cong ty Co phan Tap doan Sara,SRB - Cong ty Co phan Tap doan Sara
SRC,Cong ty Co phan Cao su Sao Vang,SRC - Cong ty Co phan Cao su Sao Vang
SRF,Cong ty Co phan Searefico,SRF - Cong ty Co phan Searefico
TSG,Cong ty Co phan Thong tin Tin hieu Duong sat Sai Gon,TSG - Cong ty Co phan Thong tin Tin hieu Duong sat Sai Gon
S4A,Cong ty Co phan Thuy dien Se San 4A,S4A - Cong ty Co phan Thuy dien Se San 4A
SSC,Cong ty Co phan Giong cay trong Mien Nam,SSC - Cong ty Co phan Giong cay trong Mien Nam
SSF,Cong ty Co phan Giao duc G Sai Gon,SSF - Cong ty Co phan Giao duc G Sai Gon
SSG,Cong ty Co phan Van tai Bien Hai Au,SSG - Cong ty Co phan Van tai Bien Hai Au
SSI,Cong ty Co phan Chung khoan SSI,SSI - Cong ty Co phan Chung khoan SSI
SSM,Cong ty Co phan Che tao ket cau thep VNECO.SSM,SSM - Cong ty Co phan Che tao ket cau thep VNECO.SSM
SSN,Cong ty Co phan Xuat nhap khau Thuy san Sai Gon,SSN - Cong ty Co phan Xuat nhap khau Thuy san Sai Gon
ST8,Cong ty Co phan Sieu Thanh,ST8 - Cong ty Co phan Sieu Thanh
STB,Ngan hang Thuong mai Co phan Sai Gon Thuong Tin,STB - Ngan hang Thuong mai Co phan Sai Gon Thuong Tin
STC,Cong ty Co phan Sach va Thiet bi truong hoc Thanh pho Ho Chi Minh,STC - Cong ty Co phan Sach va Thiet bi truong hoc Thanh pho Ho Chi Minh
STG,Cong ty Co phan Kho Van Mien Nam,STG - Cong ty Co phan Kho Van Mien Nam
STL,Cong ty Co phan Song Da - Thang Long,STL - Cong ty Co phan Song Da - Thang Long
STP,Cong ty Co phan Cong nghiep Thuong mai Song Da,STP - Cong ty Co phan Cong nghiep Thuong mai Song Da
STS,Cong ty Co phan Dich vu van tai Sai Gon,STS - Cong ty Co phan Dich vu van tai Sai Gon
STT,Cong ty Co phan Van chuyen Sai Gon Tourist,STT - Cong ty Co phan Van chuyen Sai Gon Tourist
STW,Cong ty Co phan Cap nuoc Soc Trang,STW - Cong ty Co phan Cap nuoc Soc Trang
SUM,Cong ty Co phan Do dac va Khoang san,SUM - Cong ty Co phan Do dac va Khoang san
SVC,Cong ty Co phan Dich vu tong hop Sai Gon,SVC - Cong ty Co phan Dich vu tong hop Sai Gon
SVD,Cong ty Co phan Dau tu & Thuong mai Vu Dang,SVD - Cong ty Co phan Dau tu & Thuong mai Vu Dang
SVG,Cong ty Co phan Hoi ky nghe Que han,SVG - Cong ty Co phan Hoi ky nghe Que han
SVH,Cong ty Co phan Thuy dien Song Vang,SVH - Cong ty Co phan Thuy dien Song Vang
SVI,Cong ty Co phan Bao bi Bien Hoa,SVI - Cong ty Co phan Bao bi Bien Hoa
SVN,Cong ty Co phan Tap doan Vexilla Viet Nam,SVN - Cong ty Co phan Tap doan Vexilla Viet Nam
SVT,Cong ty Co phan Cong nghe Sai Gon Vien Dong,SVT - Cong ty Co phan Cong nghe Sai Gon Vien Dong
SWC,Tong Cong ty Co phan Duong Song Mien Nam,SWC - Tong Cong ty Co phan Duong Song Mien Nam
SZE,Cong ty Co phan Moi truong Sonadezi,SZE - Cong ty Co phan Moi truong Sonadezi
SZL,Cong ty Co phan Sonadezi Long Thanh,SZL - Cong ty Co phan Sonadezi Long Thanh
SZB,Cong ty Co phan Sonadezi Long Binh,SZB - Cong ty Co phan Sonadezi Long Binh
TA3,Cong ty co phan Dau tu va Xay lap Thanh An 386,TA3 - Cong ty co phan Dau tu va Xay lap Thanh An 386
TA6,Cong ty Co phan Dau tu va Xay lap Thanh An 665,TA6 - Cong ty Co phan Dau tu va Xay lap Thanh An 665
TA9,Cong ty Co phan Xay lap Thanh An 96,TA9 - Cong ty Co phan Xay lap Thanh An 96
TKA,Cong ty Co phan Bao bi Tan Khanh An,TKA - Cong ty Co phan Bao bi Tan Khanh An
AST,Cong ty Co phan Dich vu Hang khong Taseco,AST - Cong ty Co phan Dich vu Hang khong Taseco
TAW,Cong ty Co phan Cap nuoc Trung An,TAW - Cong ty Co phan Cap nuoc Trung An
TB8,Cong ty Co phan San xuat va Kinh doanh Vat tu Thiet bi - VVMI,TB8 - Cong ty Co phan San xuat va Kinh doanh Vat tu Thiet bi - VVMI
TBC,Cong ty Co phan Thuy dien Thac Ba,TBC - Cong ty Co phan Thuy dien Thac Ba
TBD,Tong cong ty Thiet bi dien Dong Anh - Cong ty Co phan,TBD - Tong cong ty Thiet bi dien Dong Anh - Cong ty Co phan
TBH,Cong ty Co phan Tong Bach Hoa,TBH - Cong ty Co phan Tong Bach Hoa
RTB,Cong ty Co phan Cao su Tan Bien,RTB - Cong ty Co phan Cao su Tan Bien
TBT,Cong ty Co phan Xay dung Cong trinh Giao thong Ben Tre,TBT - Cong ty Co phan Xay dung Cong trinh Giao thong Ben Tre
TBX,Cong ty Co phan Xi mang Thai Binh,TBX - Cong ty Co phan Xi mang Thai Binh
TC6,Cong ty Co phan Than Coc Sau - Vinacomin,TC6 - Cong ty Co phan Than Coc Sau - Vinacomin
TCB,Ngan hang Thuong mai Co phan Ky thuong Viet Nam,TCB - Ngan hang Thuong mai Co phan Ky thuong Viet Nam
TCL,Cong ty Co phan Dai ly Giao nhan Van tai Xep do Tan Cang,TCL - Cong ty Co phan Dai ly Giao nhan Van tai Xep do Tan Cang
TCM,Cong ty Co phan Det may - Dau tu - Thuong mai Thanh Cong,TCM - Cong ty Co phan Det may - Dau tu - Thuong mai Thanh Cong
TCO,Cong ty Co phan Van tai Da phuong thuc Duyen Hai,TCO - Cong ty Co phan Van tai Da phuong thuc Duyen Hai
TCR,Cong ty Co phan Cong nghiep Gom su TAICERA,TCR - Cong ty Co phan Cong nghiep Gom su TAICERA
FUCVREIT,Quy dau tu Bat dong san Techcom Viet Nam,FUCVREIT - Quy dau tu Bat dong san Techcom Viet Nam
TCI,Cong ty Co phan Chung khoan Thanh Cong,TCI - Cong ty Co phan Chung khoan Thanh Cong
TCT,Cong ty Co phan Cap treo Nui Ba Tay Ninh,TCT - Cong ty Co phan Cap treo Nui Ba Tay Ninh
G36,Tong Cong ty 36 - Cong ty Co phan,G36 - Tong Cong ty 36 - Cong ty Co phan
TCW,Cong ty Co phan Kho Van Tan Cang,TCW - Cong ty Co phan Kho Van Tan Cang
TDC,Cong ty Co phan Kinh doanh va Phat trien Binh Duong,TDC - Cong ty Co phan Kinh doanh va Phat trien Binh Duong
VCP,Cong ty Co phan Xay dung va Nang luong VCP,VCP - Cong ty Co phan Xay dung va Nang luong VCP
GTD,Cong ty Co phan Giay Thuong Dinh,GTD - Cong ty Co phan Giay Thuong Dinh
TDG,Cong ty Co phan Dau tu TDG Global,TDG - Cong ty Co phan Dau tu TDG Global
TDH,Cong ty Co phan Phat trien Nha Thu Duc,TDH - Cong ty Co phan Phat trien Nha Thu Duc
TTD,Cong ty Co phan Benh vien Tim Tam Duc,TTD - Cong ty Co phan Benh vien Tim Tam Duc
TDM,Cong ty Co phan Nuoc Thu Dau Mot,TDM - Cong ty Co phan Nuoc Thu Dau Mot
TDN,Cong ty Co phan Than Deo Nai - Vinacomin,TDN - Cong ty Co phan Than Deo Nai - Vinacomin
NTH,Cong ty Co phan Thuy dien Nuoc Trong,NTH - Cong ty Co phan Thuy dien Nuoc Trong
TDP,Cong ty Co phan Thuan Duc,TDP - Cong ty Co phan Thuan Duc
TDS,Cong ty Co phan Thep Thu Duc - VNSTEEL,TDS - Cong ty Co phan Thep Thu Duc - VNSTEEL
TDT,Cong ty Co phan Dau tu va Phat trien TDT,TDT - Cong ty Co phan Dau tu va Phat trien TDT
TDW,Cong ty Co phan Cap nuoc Thu Duc,TDW - Cong ty Co phan Cap nuoc Thu Duc
CET,Cong ty Co phan HTC Holding,CET - Cong ty Co phan HTC Holding
TED,Tong Cong ty Tu van Thiet ke Giao thong Van tai - CTCP,TED - Tong Cong ty Tu van Thiet ke Giao thong Van tai - CTCP
TEG,Cong ty Co phan Nang Luong va Bat dong san Truong Thanh,TEG - Cong ty Co phan Nang Luong va Bat dong san Truong Thanh
TEL,Cong ty Co phan Phat trien cong trinh vien thong,TEL - Cong ty Co phan Phat trien cong trinh vien thong
TET,Cong ty Co phan Vai soi May mac Mien Bac,TET - Cong ty Co phan Vai soi May mac Mien Bac
TFC,Cong ty Co phan Trang,TFC - Cong ty Co phan Trang
TGG,Cong ty Co phan Louis Capital,TGG - Cong ty Co phan Louis Capital
TGP,Cong ty Co phan Truong Phu,TGP - Cong ty Co phan Truong Phu
TH1,Cong ty Co phan Xuat nhap khau Tong hop I Viet Nam,TH1 - Cong ty Co phan Xuat nhap khau Tong hop I Viet Nam
MTB,Cong ty Co phan Moi truong va Cong trinh do thi tinh Thai Binh,MTB - Cong ty Co phan Moi truong va Cong trinh do thi tinh Thai Binh
TLP,Tong Cong ty Thuong mai Xuat nhap khau Thanh Le - CTCP,TLP - Tong Cong ty Thuong mai Xuat nhap khau Thanh Le - CTCP
TDI,Cong ty Co phan Tap doan TDI,TDI - Cong ty Co phan Tap doan TDI
THN,Cong ty Co phan Cap nuoc Thanh Hoa,THN - Cong ty Co phan Cap nuoc Thanh Hoa
THB,Cong ty Co phan Bia Ha Noi - Thanh Hoa,THB - Cong ty Co phan Bia Ha Noi - Thanh Hoa
BTB,Cong ty Co phan Bia Ha Noi - Thai Binh,BTB - Cong ty Co phan Bia Ha Noi - Thai Binh
THD,Cong ty Co phan Thaiholdings,THD - Cong ty Co phan Thaiholdings
DTH,Cong ty Co phan Duoc - Vat tu Y te Thanh Hoa,DTH - Cong ty Co phan Duoc - Vat tu Y te Thanh Hoa
THG,Cong ty Co phan Dau tu va Xay dung Tien Giang,THG - Cong ty Co phan Dau tu va Xay dung Tien Giang
THI,Cong ty Co phan Thiet bi dien,THI - Cong ty Co phan Thiet bi dien
TQN,Cong ty Co phan Thong Quang Ninh,TQN - Cong ty Co phan Thong Quang Ninh
THS,Cong ty Co phan Thanh Hoa Song Da,THS - Cong ty Co phan Thanh Hoa Song Da
THT,Cong ty Co phan Than Ha Tu - Vinacomin,THT - Cong ty Co phan Than Ha Tu - Vinacomin
THU,Cong ty Co phan Moi truong va Cong trinh do thi Thanh Hoa,THU - Cong ty Co phan Moi truong va Cong trinh do thi Thanh Hoa
TAN,Cong ty Co phan Ca phe Thuan An,TAN - Cong ty Co phan Ca phe Thuan An
THW,Cong ty Co phan Cap nuoc Tan Hoa,THW - Cong ty Co phan Cap nuoc Tan Hoa
TIE,Cong ty Co phan TIE,TIE - Cong ty Co phan TIE
TTH,Cong ty Co phan Thuong mai va Dich vu Tien Thanh,TTH - Cong ty Co phan Thuong mai va Dich vu Tien Thanh
TIG,Cong ty Co phan Tap doan Dau tu Thang Long,TIG - Cong ty Co phan Tap doan Dau tu Thang Long
TID,Cong ty Co phan Tong Cong ty Tin Nghia,TID - Cong ty Co phan Tong Cong ty Tin Nghia
TIP,Cong ty Co phan Phat trien Khu cong nghiep Tin Nghia,TIP - Cong ty Co phan Phat trien Khu cong nghiep Tin Nghia
DTG,Cong ty Co phan Duoc pham Tipharco,DTG - Cong ty Co phan Duoc pham Tipharco
TIS,Cong ty Co phan Gang thep Thai Nguyen,TIS - Cong ty Co phan Gang thep Thai Nguyen
TIX,Cong ty Co phan San xuat Kinh doanh Xuat nhap khau Dich vu va Dau tu Tan Binh,TIX - Cong ty Co phan San xuat Kinh doanh Xuat nhap khau Dich vu va Dau tu Tan Binh
TJC,Cong ty Co phan Dich vu Van tai va Thuong mai,TJC - Cong ty Co phan Dich vu Van tai va Thuong mai
TKC,Cong ty Co phan Xay dung va Kinh doanh Dia oc Tan Ky,TKC - Cong ty Co phan Xay dung va Kinh doanh Dia oc Tan Ky
TKG,Cong ty Co phan San xuat va Thuong mai Tung Khanh,TKG - Cong ty Co phan San xuat va Thuong mai Tung Khanh
TKU,Cong ty Co phan Cong nghiep Tung Kuang,TKU - Cong ty Co phan Cong nghiep Tung Kuang
TL4,Tong Cong ty Xay dung Thuy loi 4 - Cong ty Co phan,TL4 - Tong Cong ty Xay dung Thuy loi 4 - Cong ty Co phan
TLD,Cong ty Co phan Dau tu Xay dung va Phat trien Do thi Thang Long,TLD - Cong ty Co phan Dau tu Xay dung va Phat trien Do thi Thang Long
TLG,Cong ty Co phan Tap doan Thien Long,TLG - Cong ty Co phan Tap doan Thien Long
TTL,Tong Cong ty Thang Long - Cong ty Co phan,TTL - Tong Cong ty Thang Long - Cong ty Co phan
TLH,Cong ty Co phan Tap doan Thep Tien Len,TLH - Cong ty Co phan Tap doan Thep Tien Len
TLI,Cong ty Co phan May Quoc te Thang Loi,TLI - Cong ty Co phan May Quoc te Thang Loi
MBS,Cong ty Co phan Chung khoan MB,MBS - Cong ty Co phan Chung khoan MB
TLT,Cong ty Co phan Viglacera Thang Long,TLT - Cong ty Co phan Viglacera Thang Long
TMC,Cong ty Co phan Thuong mai Xuat nhap khau Thu Duc,TMC - Cong ty Co phan Thuong mai Xuat nhap khau Thu Duc
TMP,Cong ty Co phan Thuy dien Thac Mo,TMP - Cong ty Co phan Thuy dien Thac Mo
TMS,Cong ty Co phan Transimex,TMS - Cong ty Co phan Transimex
TMT,Cong ty Co phan O to TMT,TMT - Cong ty Co phan O to TMT
TMW,Cong ty Co phan Tong hop Go Tan Mai,TMW - Cong ty Co phan Tong hop Go Tan Mai
TMX,Cong ty Co phan VICEM Thuong mai Xi mang,TMX - Cong ty Co phan VICEM Thuong mai Xi mang
TN1,Cong ty Co phan Thuong mai Dich vu TNS Holdings,TN1 - Cong ty Co phan Thuong mai Dich vu TNS Holdings
TNA,Cong ty Co phan Thuong mai Xuat nhap khau Thien Nam,TNA - Cong ty Co phan Thuong mai Xuat nhap khau Thien Nam
TNB,Cong ty Co phan Thep Nha Be - VNSTEEL,TNB - Cong ty Co phan Thep Nha Be - VNSTEEL
STH,Cong ty Co phan Phat hanh sach Thai Nguyen,STH - Cong ty Co phan Phat hanh sach Thai Nguyen
TNC,Cong ty Co phan Cao su Thong Nhat,TNC - Cong ty Co phan Cao su Thong Nhat
BAX,Cong ty Co phan Thong Nhat,BAX - Cong ty Co phan Thong Nhat
TNS,Cong ty Co phan Thep Tam La Thong Nhat,TNS - Cong ty Co phan Thep Tam La Thong Nhat
TNG,Cong ty Co phan Dau tu va Thuong mai TNG,TNG - Cong ty Co phan Dau tu va Thuong mai TNG
TNI,Cong ty Co phan Tap doan Thanh Nam,TNI - Cong ty Co phan Tap doan Thanh Nam
TNM,Cong ty Co phan Xuat nhap khau va Xay dung Cong trinh,TNM - Cong ty Co phan Xuat nhap khau va Xay dung Cong trinh
TNP,Cong ty Co phan Cang Thi Nai,TNP - Cong ty Co phan Cang Thi Nai
TNT,Cong ty Co phan Tap doan TNT,TNT - Cong ty Co phan Tap doan TNT
TCJ,Cong ty Co phan To Chau,TCJ - Cong ty Co phan To Chau
TOP,Cong ty Co phan Phan phoi Top One,TOP - Cong ty Co phan Phan phoi Top One
TOT,Cong ty Co phan Transimex Logistics,TOT - Cong ty Co phan Transimex Logistics
TPB,Ngan hang Thuong mai Co phan Tien Phong,TPB - Ngan hang Thuong mai Co phan Tien Phong
BCF,Cong ty Co phan Thuc pham Bich Chi,BCF - Cong ty Co phan Thuc pham Bich Chi
TPC,Cong ty Co phan Nhua Tan Dai Hung,TPC - Cong ty Co phan Nhua Tan Dai Hung
TPH,Cong ty Co phan In Sach giao khoa tai Thanh pho Ha Noi,TPH - Cong ty Co phan In Sach giao khoa tai Thanh pho Ha Noi
TPP,Cong ty Co phan Tan Phu Viet Nam,TPP - Cong ty Co phan Tan Phu Viet Nam
THP,Cong ty Co phan Thuy san va Thuong mai Thuan Phuoc,THP - Cong ty Co phan Thuy san va Thuong mai Thuan Phuoc
TRA,Cong ty Co phan Traphaco,TRA - Cong ty Co phan Traphaco
TR1,Cong ty Co phan Van Tai 1 Traco,TR1 - Cong ty Co phan Van Tai 1 Traco
TCD,Cong ty Co phan Dau tu Phat trien Cong nghiep va Van tai,TCD - Cong ty Co phan Dau tu Phat trien Cong nghiep va Van tai
TVW,Cong ty Co phan Cap thoat nuoc Tra Vinh,TVW - Cong ty Co phan Cap thoat nuoc Tra Vinh
TRC,Cong ty Co phan Cao su Tay Ninh,TRC - Cong ty Co phan Cao su Tay Ninh
TRS,Cong ty Co phan Van tai va Dich vu Hang Hai,TRS - Cong ty Co phan Van tai va Dich vu Hang Hai
TAR,Cong ty Co phan Nong nghiep Cong nghe cao Trung An,TAR - Cong ty Co phan Nong nghiep Cong nghe cao Trung An
TDF,Cong ty Co phan Trung Do,TDF - Cong ty Co phan Trung Do
TVB,Cong ty Co phan Chung khoan Tri Viet,TVB - Cong ty Co phan Chung khoan Tri Viet
TS4,Cong ty Co phan Thuy san so 4,TS4 - Cong ty Co phan Thuy san so 4
TSB,Cong ty Co phan ac quy Tia Sang,TSB - Cong ty Co phan ac quy Tia Sang
TSC,Cong ty Co phan Vat tu Ky thuat Nong nghiep Can Tho,TSC - Cong ty Co phan Vat tu Ky thuat Nong nghiep Can Tho
TSD,Cong ty Co phan Du lich Truong Son Coecco,TSD - Cong ty Co phan Du lich Truong Son Coecco
TST,Cong ty Co phan Dich vu Ky thuat Vien thong,TST - Cong ty Co phan Dich vu Ky thuat Vien thong
TTA,Cong ty Co phan Dau tu Xay dung va Phat trien Truong Thanh,TTA - Cong ty Co phan Dau tu Xay dung va Phat trien Truong Thanh
TTB,Cong ty Co phan Tap doan Tien Bo,TTB - Cong ty Co phan Tap doan Tien Bo
TTC,Cong ty Co phan Gach men Thanh Thanh,TTC - Cong ty Co phan Gach men Thanh Thanh
TTT,Cong ty Co phan Du Lich - Thuong Mai Tay Ninh,TTT - Cong ty Co phan Du Lich - Thuong Mai Tay Ninh
TTF,Cong ty Co phan Tap doan Ky nghe Go Truong Thanh,TTF - Cong ty Co phan Tap doan Ky nghe Go Truong Thanh
TTG,Cong ty Co phan May Thanh Tri,TTG - Cong ty Co phan May Thanh Tri
HUB,Cong ty Co phan Xay lap Thua Thien Hue,HUB - Cong ty Co phan Xay lap Thua Thien Hue
TRT,Cong ty Co phan RedstarCera,TRT - Cong ty Co phan RedstarCera
TTN,Cong ty Co phan Cong nghe & Truyen thong Viet Nam,TTN - Cong ty Co phan Cong nghe & Truyen thong Viet Nam
TTP,Cong ty Co phan Bao bi Nhua Tan Tien,TTP - Cong ty Co phan Bao bi Nhua Tan Tien
TTZ,Cong ty Co phan Dau tu Xay dung va Cong nghe Tien Trung,TTZ - Cong ty Co phan Dau tu Xay dung va Cong nghe Tien Trung
GND,Cong ty Co phan Gach ngoi Dong Nai,GND - Cong ty Co phan Gach ngoi Dong Nai
TQW,Cong ty Co phan Cap thoat nuoc Tuyen Quang,TQW - Cong ty Co phan Cap thoat nuoc Tuyen Quang
TV1,Cong ty Co phan Tu van Xay dung Dien 1,TV1 - Cong ty Co phan Tu van Xay dung Dien 1
TV2,Cong ty Co phan Tu van Xay dung Dien 2,TV2 - Cong ty Co phan Tu van Xay dung Dien 2
TV3,Cong ty Co phan Tu van Xay dung Dien 3,TV3 - Cong ty Co phan Tu van Xay dung Dien 3
TV4,Cong ty Co phan Tu van Xay dung Dien 4,TV4 - Cong ty Co phan Tu van Xay dung Dien 4
TV6,Cong ty Co phan Thuong mai Dau tu xay lap dien Thinh Vuong,TV6 - Cong ty Co phan Thuong mai Dau tu xay lap dien Thinh Vuong
TVA,Cong ty co phan Su Viglacera Thanh Tri,TVA - Cong ty co phan Su Viglacera Thanh Tri
TVC,Cong ty Co phan Tap doan Quan ly Tai san Tri Viet,TVC - Cong ty Co phan Tap doan Quan ly Tai san Tri Viet
TVD,Cong ty Co phan Than Vang Danh - Vinacomin,TVD - Cong ty Co phan Than Vang Danh - Vinacomin
TVG,Cong ty Co phan Tu van Dau tu va Xay dung Giao thong Van tai,TVG - Cong ty Co phan Tu van Dau tu va Xay dung Giao thong Van tai
TVP,Cong ty Co phan Duoc pham TV.Pharm,TVP - Cong ty Co phan Duoc pham TV.Pharm
TVS,Cong ty Co phan Chung khoan Thien Viet,TVS - Cong ty Co phan Chung khoan Thien Viet
TNW,Cong ty Co phan Nuoc sach Thai Nguyen,TNW - Cong ty Co phan Nuoc sach Thai Nguyen
TXM,Cong ty Co phan VICEM Thach cao Xi Mang,TXM - Cong ty Co phan VICEM Thach cao Xi Mang
TYA,Cong ty Co phan Day va Cap dien Taya Viet Nam,TYA - Cong ty Co phan Day va Cap dien Taya Viet Nam
UCT,Cong ty Co phan Do thi Can Tho,UCT - Cong ty Co phan Do thi Can Tho
UDC,Cong ty Co phan Xay dung va Phat trien do thi Tinh Ba Ria - Vung Tau,UDC - Cong ty Co phan Xay dung va Phat trien do thi Tinh Ba Ria - Vung Tau
UDJ,Cong ty Co phan Phat trien Do thi,UDJ - Cong ty Co phan Phat trien Do thi
UEM,Cong ty Co phan Co dien Uong Bi - Vinacomin,UEM - Cong ty Co phan Co dien Uong Bi - Vinacomin
FCC,Cong ty Co phan Lien hop Thuc pham,FCC - Cong ty Co phan Lien hop Thuc pham
UIC,Cong ty Co phan Dau tu Phat trien Nha va Do thi IDICO,UIC - Cong ty Co phan Dau tu Phat trien Nha va Do thi IDICO
UMC,Cong ty Co phan Cong trinh do thi Nam Dinh,UMC - Cong ty Co phan Cong trinh do thi Nam Dinh
UNI,Cong ty Co phan Dau tu va Phat trien Sao Mai Viet,UNI - Cong ty Co phan Dau tu va Phat trien Sao Mai Viet
UPC,Cong ty Co phan Phat trien Cong vien Cay xanh va Do thi Vung Tau,UPC - Cong ty Co phan Phat trien Cong vien Cay xanh va Do thi Vung Tau
UPH,Cong ty Co phan Duoc pham TW25,UPH - Cong ty Co phan Duoc pham TW25
USC,Cong ty Co phan Khao sat va Xay dung - USCO,USC - Cong ty Co phan Khao sat va Xay dung - USCO
USD,Cong ty Co phan Cong trinh Do thi Soc Trang,USD - Cong ty Co phan Cong trinh Do thi Soc Trang
V11,Cong ty Co phan Xay dung so 11,V11 - Cong ty Co phan Xay dung so 11
V12,Cong ty Co phan Xay dung so 12,V12 - Cong ty Co phan Xay dung so 12
V15,Cong ty Co phan Xay dung so 15,V15 - Cong ty Co phan Xay dung so 15
V21,Cong ty Co phan Vinaconex 21,V21 - Cong ty Co phan Vinaconex 21
VAB,Ngan hang Thuong mai Co phan Viet a,VAB - Ngan hang Thuong mai Co phan Viet a
VAF,Cong ty Co phan Phan lan nung chay Van Dien,VAF - Cong ty Co phan Phan lan nung chay Van Dien
PAT,Cong ty Co phan Phot pho Apatit Viet Nam,PAT - Cong ty Co phan Phot pho Apatit Viet Nam
VAT,Cong ty Co phan VT Van Xuan,VAT - Cong ty Co phan VT Van Xuan
VAV,Cong ty Co phan VIWACO,VAV - Cong ty Co phan VIWACO
VBC,"Cong ty Co phan Nhua, Bao bi Vinh","VBC - Cong ty Co phan Nhua, Bao bi Vinh"
VBH,Cong ty Co phan Dien tu Binh Hoa,VBH - Cong ty Co phan Dien tu Binh Hoa
VC1,Cong ty Co phan Xay dung so 1,VC1 - Cong ty Co phan Xay dung so 1
VC2,Cong ty Co phan Dau tu va Xay dung VINA2,VC2 - Cong ty Co phan Dau tu va Xay dung VINA2
VC3,Cong ty Co phan Tap doan Nam Me Kong,VC3 - Cong ty Co phan Tap doan Nam Me Kong
VC5,Cong ty Co phan xay dung so 5,VC5 - Cong ty Co phan xay dung so 5
VC6,Cong ty co phan Xay dung va Dau tu Visicons,VC6 - Cong ty co phan Xay dung va Dau tu Visicons
VC7,Cong ty Co phan Tap doan BGI,VC7 - Cong ty Co phan Tap doan BGI
VC9,Cong ty Co phan Xay dung so 9 - VC9,VC9 - Cong ty Co phan Xay dung so 9 - VC9
VCA,Cong ty Co phan Thep VICASA - VNSTEEL,VCA - Cong ty Co phan Thep VICASA - VNSTEEL
VCB,Ngan hang Thuong mai Co phan Ngoai thuong Viet Nam,VCB - Ngan hang Thuong mai Co phan Ngoai thuong Viet Nam
VCC,Cong ty Co phan Vinaconex 25,VCC - Cong ty Co phan Vinaconex 25
