symbol,company_name,company
VVS,Cong ty Co phan Dau tu Phat trien May Viet Nam,VVS - Cong ty Co phan Dau tu Phat trien May Viet Nam
XDC,Cong ty TNHH MTV Xay dung Cong trinh Tan Cang,XDC - Cong ty TNHH MTV Xay dung Cong trinh Tan Cang
HSV,Cong ty Co phan Gang Thep Ha Noi,HSV - Cong ty Co phan Gang Thep Ha Noi
CST,Cong ty Co phan Than Cao Son - TKV,CST - Cong ty Co phan Than Cao Son - TKV
BVL,Cong ty Co phan BV Land,BVL - Cong ty Co phan BV Land
SGI,Cong ty Co phan Dau tu phat trien Sai Gon 3 Group,SGI - Cong ty Co phan Dau tu phat trien Sai Gon 3 Group
TOS,Cong ty Co phan Dich vu bien Tan Cang,TOS - Cong ty Co phan Dich vu bien Tan Cang
VTZ,Cong ty Co phan San xuat va Thuong mai Nhua Viet Thanh,VTZ - Cong ty Co phan San xuat va Thuong mai Nhua Viet Thanh
SSH,Cong ty Co phan Phat trien Sunshine Homes,SSH - Cong ty Co phan Phat trien Sunshine Homes
BCA,Cong ty co phan B.C.H,BCA - Cong ty co phan B.C.H
FUCTVGF3,Quy Dau tu Tang truong Thien Viet 3,FUCTVGF3 - Quy Dau tu Tang truong Thien Viet 3
FUEIP100,Quy ETF IPAAM VN100,FUEIP100 - Quy ETF IPAAM VN100
GMH,Cong ty Co phan Minh Hung Quang Tri,GMH - Cong ty Co phan Minh Hung Quang Tri
BIG,Cong ty co phan BIG Invest Group,BIG - Cong ty co phan BIG Invest Group
CMM,Cong ty Co phan Camimex,CMM - Cong ty Co phan Camimex
CNA,Cong ty Co phan Tong cong ty Che Nghe An,CNA - Cong ty Co phan Tong cong ty Che Nghe An
FUEKIV30,Quy ETF KIM GROWTH VN30,FUEKIV30 - Quy ETF KIM GROWTH VN30
ODE,Cong ty co phan Tap doan Truyen thong va Giai tri ODE,ODE - Cong ty co phan Tap doan Truyen thong va Giai tri ODE
HMR,Cong ty co phan Da Hoang Mai,HMR - Cong ty co phan Da Hoang Mai
PCH,Cong ty Co phan Nhua Picomat,PCH - Cong ty Co phan Nhua Picomat
DSD,Cong ty co phan DHC Suoi Doi,DSD - Cong ty co phan DHC Suoi Doi
NO1,Cong ty Co phan Tap doan 911,NO1 - Cong ty Co phan Tap doan 911
MGR,Cong ty co phan Tap doan MGROUP,MGR - Cong ty co phan Tap doan MGROUP
PPT,Cong ty co phan Petro Times,PPT - Cong ty co phan Petro Times
CVP,Cong ty co phan Cang Cua Viet,CVP - Cong ty co phan Cang Cua Viet
CAR,Cong ty co phan Tap doan Giao duc Tri Viet,CAR - Cong ty co phan Tap doan Giao duc Tri Viet
GPC,Cong ty Co phan Tap doan Green+,GPC - Cong ty Co phan Tap doan Green+
FUCTVGF4,Quy Dau tu Tang truong Thien Viet 4,FUCTVGF4 - Quy Dau tu Tang truong Thien Viet 4
FUEDCMID,Quy ETF DCVFMVNMIDCAP,FUEDCMID - Quy ETF DCVFMVNMIDCAP
FUEKIVFS,Quy ETF KIM GROWTH VNFINSELECT,FUEKIVFS - Quy ETF KIM GROWTH VNFINSELECT
GCF,Cong ty Co phan Thuc pham G.C,GCF - Cong ty Co phan Thuc pham G.C
LPT,Cong ty Co phan Thuong mai va San xuat Lap Phuong Thanh,LPT - Cong ty Co phan Thuong mai va San xuat Lap Phuong Thanh
AAA,Cong ty Co phan Nhua An Phat Xanh,AAA - Cong ty Co phan Nhua An Phat Xanh
AAM,Cong ty Co Phan Thuy San MeKong,AAM - Cong ty Co Phan Thuy San MeKong
AAT,Cong ty Co phan Tap doan Tien Son Thanh Hoa,AAT - Cong ty Co phan Tap doan Tien Son Thanh Hoa
AAV,Cong ty Co phan AAV Group,AAV - Cong ty Co phan AAV Group
ABB,Ngan hang Thuong mai Co phan An Binh,ABB - Ngan hang Thuong mai Co phan An Binh
ABI,Cong ty Co phan Bao hiem Ngan hang Nong Nghiep,ABI - Cong ty Co phan Bao hiem Ngan hang Nong Nghiep
ABR,Cong ty Co phan Dau tu Nhan Hieu Viet,ABR - Cong ty Co phan Dau tu Nhan Hieu Viet
ABS,Cong ty Co phan Dich vu Nong nghiep Binh Thuan,ABS - Cong ty Co phan Dich vu Nong nghiep Binh Thuan
ABT,Cong ty Co phan Xuat nhap khau Thuy san Ben Tre,ABT - Cong ty Co phan Xuat nhap khau Thuy san Ben Tre
ACB,Ngan hang Thuong mai Co phan a Chau,ACB - Ngan hang Thuong mai Co phan a Chau
ACC,Cong ty Co phan Dau tu va Xay dung Binh Duong ACC,ACC - Cong ty Co phan Dau tu va Xay dung Binh Duong ACC
ACE,Cong ty Co phan Be tong ly tam An Giang,ACE - Cong ty Co phan Be tong ly tam An Giang
ACL,Cong ty Co phan Xuat nhap khau Thuy san Cuu Long An Giang,ACL - Cong ty Co phan Xuat nhap khau Thuy san Cuu Long An Giang
ACM,Cong ty Co phan Tap doan Khoang san a Cuong,ACM - Cong ty Co phan Tap doan Khoang san a Cuong
ACS,Cong ty Co phan Xay lap Thuong mai 2,ACS - Cong ty Co phan Xay lap Thuong mai 2
ACV,Tong Cong ty Cang Hang khong Viet Nam - CTCP,ACV - Tong Cong ty Cang Hang khong Viet Nam - CTCP
ADC,Cong ty Co phan Mi thuat va Truyen thong,ADC - Cong ty Co phan Mi thuat va Truyen thong
ADP,Cong ty Co phan Son a Dong,ADP - Cong ty Co phan Son a Dong
AFX,Cong ty Co phan Xuat nhap khau Nong san Thuc pham An Giang,AFX - Cong ty Co phan Xuat nhap khau Nong san Thuc pham An Giang
AGF,Cong ty Co phan Xuat nhap khau Thuy san An Giang,AGF - Cong ty Co phan Xuat nhap khau Thuy san An Giang
CKA,Cong ty Co phan Co khi An Giang,CKA - Cong ty Co phan Co khi An Giang
AGP,Cong ty Co phan Duoc pham AGIMEXPHARM,AGP - Cong ty Co phan Duoc pham AGIMEXPHARM
AGM,Cong ty Co phan Xuat nhap khau An Giang,AGM - Cong ty Co phan Xuat nhap khau An Giang
CAG,Cong ty Co phan Cang An Giang,CAG - Cong ty Co phan Cang An Giang
LTG,Cong ty Co phan Tap doan Loc Troi,LTG - Cong ty Co phan Tap doan Loc Troi
AGR,Cong ty Co phan Chung khoan AGRIBANK,AGR - Cong ty Co phan Chung khoan AGRIBANK
AGG,Cong ty Co phan Dau tu va Phat trien Bat dong san An Gia,AGG - Cong ty Co phan Dau tu va Phat trien Bat dong san An Gia
AGX,Cong ty Co phan Thuc pham Nong san Xuat khau Sai Gon,AGX - Cong ty Co phan Thuc pham Nong san Xuat khau Sai Gon
AG1,Cong ty Co phan 28.1,AG1 - Cong ty Co phan 28.1
AGE,Cong ty Co phan Moi truong Do thi An Giang,AGE - Cong ty Co phan Moi truong Do thi An Giang
ALT,Cong ty Co phan Van hoa Tan Binh,ALT - Cong ty Co phan Van hoa Tan Binh
ALV,Cong ty Co phan Xay dung ALVICO,ALV - Cong ty Co phan Xay dung ALVICO
AMC,Cong ty Co phan Khoang san a Chau,AMC - Cong ty Co phan Khoang san a Chau
AMD,Cong ty Co phan Dau tu va Khoang san FLC Stone,AMD - Cong ty Co phan Dau tu va Khoang san FLC Stone
AME,Cong ty co phan Alphanam E&C,AME - Cong ty co phan Alphanam E&C
AMP,Cong ty Co phan Armephaco,AMP - Cong ty Co phan Armephaco
AMV,Cong ty Co phan San xuat Kinh doanh Duoc va Trang thiet bi Y te Viet My,AMV - Cong ty Co phan San xuat Kinh doanh Duoc va Trang thiet bi Y te Viet My
ACG,Cong ty Co phan Go An Cuong,ACG - Cong ty Co phan Go An Cuong
ANT,Cong ty Co phan Rau qua Thuc pham An Giang,ANT - Cong ty Co phan Rau qua Thuc pham An Giang
ANV,Cong ty Co phan Nam Viet,ANV - Cong ty Co phan Nam Viet
APC,Cong ty Co phan Chieu xa An Phu,APC - Cong ty Co phan Chieu xa An Phu
APF,Cong ty Co phan Nong san Thuc pham Quang Ngai,APF - Cong ty Co phan Nong san Thuc pham Quang Ngai
APG,Cong ty Co phan Chung khoan APG,APG - Cong ty Co phan Chung khoan APG
APH,Cong ty Co phan Tap doan An Phat Holdings,APH - Cong ty Co phan Tap doan An Phat Holdings
API,Cong ty Co phan Dau tu Chau a - Thai Binh Duong,API - Cong ty Co phan Dau tu Chau a - Thai Binh Duong
APL,Cong ty Co phan Co khi va Thiet bi ap luc - VVMI,APL - Cong ty Co phan Co khi va Thiet bi ap luc - VVMI
APP,Cong ty Co phan Phat trien Phu gia va San pham dau mo,APP - Cong ty Co phan Phat trien Phu gia va San pham dau mo
APS,Cong ty Co phan Chung khoan Chau a - Thai Binh Duong,APS - Cong ty Co phan Chung khoan Chau a - Thai Binh Duong
HII,Cong ty Co phan An Tien Industries,HII - Cong ty Co phan An Tien Industries
ARM,Cong ty Co phan Xuat nhap khau Hang khong,ARM - Cong ty Co phan Xuat nhap khau Hang khong
ASA,Cong ty Co phan ASA,ASA - Cong ty Co phan ASA
A32,Cong ty Co phan 32,A32 - Cong ty Co phan 32
ASG,Cong ty Co phan Tap doan ASG,ASG - Cong ty Co phan Tap doan ASG
ASM,Cong ty Co phan Tap doan Sao Mai,ASM - Cong ty Co phan Tap doan Sao Mai
ASP,Cong ty Co phan Tap doan Dau khi An Pha,ASP - Cong ty Co phan Tap doan Dau khi An Pha
ATA,Cong ty Co phan NTACO,ATA - Cong ty Co phan NTACO
ATG,Cong ty Co phan An Truong An,ATG - Cong ty Co phan An Truong An
ATB,Cong ty Co phan An Thinh,ATB - Cong ty Co phan An Thinh
ATS,Cong ty Co phan Tap doan Duoc pham Atesco,ATS - Cong ty Co phan Tap doan Duoc pham Atesco
AVF,Cong ty Co phan Viet An,AVF - Cong ty Co phan Viet An
AVC,Cong ty Co phan Thuy dien A Vuong,AVC - Cong ty Co phan Thuy dien A Vuong
B82,Cong ty Co phan 482,B82 - Cong ty Co phan 482
BAF,Cong ty co phan Nong nghiep BAF Viet Nam,BAF - Cong ty co phan Nong nghiep BAF Viet Nam
BAL,Cong ty Co phan Bao bi Bia - Ruou - Nuoc giai khat,BAL - Cong ty Co phan Bao bi Bia - Ruou - Nuoc giai khat
BCV,Cong ty co phan Du lich va Thuong mai Bang Giang Cao Bang - Vimico,BCV - Cong ty co phan Du lich va Thuong mai Bang Giang Cao Bang - Vimico
BNA,Cong ty Co phan Dau tu San xuat Bao Ngoc,BNA - Cong ty Co phan Dau tu San xuat Bao Ngoc
BRR,Cong ty Co phan Cao su Ba Ria,BRR - Cong ty Co phan Cao su Ba Ria
CBC,Cong ty Co phan Che Bau Can,CBC - Cong ty Co phan Che Bau Can
BLW,Cong ty Co phan Cap nuoc Bac Lieu,BLW - Cong ty Co phan Cap nuoc Bac Lieu
BBC,Cong ty Co phan Bibica,BBC - Cong ty Co phan Bibica
VLB,Cong ty Co phan Xay dung va San xuat Vat lieu Xay dung Bien Hoa,VLB - Cong ty Co phan Xay dung va San xuat Vat lieu Xay dung Bien Hoa
BBH,Cong ty Co phan Bao bi Hoang Thach,BBH - Cong ty Co phan Bao bi Hoang Thach
BBS,Cong ty Co phan VICEM Bao bi But Son,BBS - Cong ty Co phan VICEM Bao bi But Son
BBT,Cong ty Co phan Bong Bach Tuyet,BBT - Cong ty Co phan Bong Bach Tuyet
BCB,Cong ty Co phan 397,BCB - Cong ty Co phan 397
BCC,Cong ty Co phan Xi mang Bim Son,BCC - Cong ty Co phan Xi mang Bim Son
BCE,Cong ty Co phan Xay dung va Giao thong Binh Duong,BCE - Cong ty Co phan Xay dung va Giao thong Binh Duong
BCG,Cong ty Co phan Tap doan Bamboo Capital,BCG - Cong ty Co phan Tap doan Bamboo Capital
BCP,Cong ty Co phan Duoc Enlie,BCP - Cong ty Co phan Duoc Enlie
BDB,Cong ty Co phan Sach va Thiet bi Binh Dinh,BDB - Cong ty Co phan Sach va Thiet bi Binh Dinh
MVC,Cong ty Co phan Vat lieu va Xay dung Binh Duong,MVC - Cong ty Co phan Vat lieu va Xay dung Binh Duong
BFC,Cong ty Co phan Phan bon Binh Dien,BFC - Cong ty Co phan Phan bon Binh Dien
BDG,Cong ty Co phan May mac Binh Duong,BDG - Cong ty Co phan May mac Binh Duong
BSA,Cong ty Co phan Thuy dien Buon Don,BSA - Cong ty Co phan Thuy dien Buon Don
PRT,Tong Cong ty San xuat - Xuat nhap khau Binh Duong - Cong ty co phan,PRT - Tong Cong ty San xuat - Xuat nhap khau Binh Duong - Cong ty co phan
BDW,Cong ty Co phan Cap thoat nuoc Binh Dinh,BDW - Cong ty Co phan Cap thoat nuoc Binh Dinh
BED,Cong ty Co phan Sach va Thiet bi truong hoc Da Nang,BED - Cong ty Co phan Sach va Thiet bi truong hoc Da Nang
BEL,Cong ty Co phan Dien tu Bien Hoa,BEL - Cong ty Co phan Dien tu Bien Hoa
NBT,Cong ty Co phan Cap thoat nuoc Ben Tre,NBT - Cong ty Co phan Cap thoat nuoc Ben Tre
BGW,Cong ty Co phan Nuoc sach Bac Giang,BGW - Cong ty Co phan Nuoc sach Bac Giang
BHA,Cong ty co phan Thuy dien Bac Ha,BHA - Cong ty co phan Thuy dien Bac Ha
BHC,Cong ty Co phan Be tong Bien Hoa,BHC - Cong ty Co phan Be tong Bien Hoa
BHK,Cong ty Co phan Bia Ha Noi - Kim Bai,BHK - Cong ty Co phan Bia Ha Noi - Kim Bai
BHN,Tong Cong ty Co phan Bia - Ruou - Nuoc giai khat Ha Noi,BHN - Tong Cong ty Co phan Bia - Ruou - Nuoc giai khat Ha Noi
BHP,Cong ty Co phan Bia Ha Noi - Hai Phong,BHP - Cong ty Co phan Bia Ha Noi - Hai Phong
BHT,Cong ty Co phan Dau tu Xay dung Bach Dang TMC,BHT - Cong ty Co phan Dau tu Xay dung Bach Dang TMC
BIC,Tong Cong ty Co phan Bao hiem Ngan hang Dau tu va Phat trien Viet Nam,BIC - Tong Cong ty Co phan Bao hiem Ngan hang Dau tu va Phat trien Viet Nam
BID,Ngan hang Thuong mai Co phan Dau tu va Phat trien Viet Nam,BID - Ngan hang Thuong mai Co phan Dau tu va Phat trien Viet Nam
BCM,Tong Cong ty Dau tu va Phat trien Cong nghiep - CTCP,BCM - Tong Cong ty Dau tu va Phat trien Cong nghiep - CTCP
BLT,Cong ty Co phan Luong thuc Binh Dinh,BLT - Cong ty Co phan Luong thuc Binh Dinh
DBD,Cong ty Co phan Duoc - Trang thiet bi y te Binh Dinh,DBD - Cong ty Co phan Duoc - Trang thiet bi y te Binh Dinh
BHG,Cong ty Co phan Che Bien Ho,BHG - Cong ty Co phan Che Bien Ho
BII,Cong ty Co phan Dau tu va Phat trien Cong nghiep Bao Thu,BII - Cong ty Co phan Dau tu va Phat trien Cong nghiep Bao Thu
BIO,Cong ty Co phan Vac xin va Sinh pham Nha Trang,BIO - Cong ty Co phan Vac xin va Sinh pham Nha Trang
BWE,Cong ty Co phan Nuoc - Moi truong Binh Duong,BWE - Cong ty Co phan Nuoc - Moi truong Binh Duong
BKC,Cong ty Co phan Khoang san Bac Kan,BKC - Cong ty Co phan Khoang san Bac Kan
BKG,Cong ty Co phan Dau tu BKG Viet Nam,BKG - Cong ty Co phan Dau tu BKG Viet Nam
BLF,Cong ty Co phan Thuy san Bac Lieu,BLF - Cong ty Co phan Thuy san Bac Lieu
BLI,Tong Cong ty Co phan Bao hiem Bao Long,BLI - Tong Cong ty Co phan Bao hiem Bao Long
MH3,Cong ty Co phan Khu cong nghiep Cao su Binh Long,MH3 - Cong ty Co phan Khu cong nghiep Cao su Binh Long
DTB,Cong ty Co phan Cong trinh Do thi Bao Loc,DTB - Cong ty Co phan Cong trinh Do thi Bao Loc
BMC,Cong ty Co phan Khoang san Binh Dinh,BMC - Cong ty Co phan Khoang san Binh Dinh
BMD,Cong ty Co phan Moi truong va Dich vu Do thi Binh Thuan,BMD - Cong ty Co phan Moi truong va Dich vu Do thi Binh Thuan
BMF,Cong ty Co phan Vat lieu Xay dung va Chat dot Dong Nai,BMF - Cong ty Co phan Vat lieu Xay dung va Chat dot Dong Nai
BMI,Tong Cong ty Co phan Bao Minh,BMI - Tong Cong ty Co phan Bao Minh
BMG,Cong ty Co phan May Binh Minh,BMG - Cong ty Co phan May Binh Minh
BMJ,Cong ty Co phan Khoang san Mien Dong AHP,BMJ - Cong ty Co phan Khoang san Mien Dong AHP
BMN,Cong ty Co phan 715,BMN - Cong ty Co phan 715
BMP,Cong ty Co phan Nhua Binh Minh,BMP - Cong ty Co phan Nhua Binh Minh
BMS,Cong ty Co phan Chung khoan Bao Minh,BMS - Cong ty Co phan Chung khoan Bao Minh
MBN,Cong ty Co phan Moi truong va Cong trinh do thi Bac Ninh,MBN - Cong ty Co phan Moi truong va Cong trinh do thi Bac Ninh
BNW,Cong ty Co phan Nuoc sach Bac Ninh,BNW - Cong ty Co phan Nuoc sach Bac Ninh
BOT,Cong ty Co phan BOT Cau Thai Ha,BOT - Cong ty Co phan BOT Cau Thai Ha
BPC,Cong ty Co phan Vicem Bao bi Bim Son,BPC - Cong ty Co phan Vicem Bao bi Bim Son
BRC,Cong ty Co phan Cao su Ben Thanh,BRC - Cong ty Co phan Cao su Ben Thanh
BRS,Cong ty Co phan Dich vu Do thi Ba Ria,BRS - Cong ty Co phan Dich vu Do thi Ba Ria
VTG,Cong ty Co phan Du lich tinh Ba Ria - Vung Tau,VTG - Cong ty Co phan Du lich tinh Ba Ria - Vung Tau
BSC,Cong ty Co phan Dich vu Ben Thanh,BSC - Cong ty Co phan Dich vu Ben Thanh
BSP,Cong ty Co phan Bia Sai Gon - Phu Tho,BSP - Cong ty Co phan Bia Sai Gon - Phu Tho
BSI,Cong ty Co phan Chung khoan Ngan hang Dau tu va Phat trien Viet Nam,BSI - Cong ty Co phan Chung khoan Ngan hang Dau tu va Phat trien Viet Nam
BSR,Cong ty Co phan Loc Hoa dau Binh Son,BSR - Cong ty Co phan Loc Hoa dau Binh Son
BST,Cong ty Co phan Sach va Thiet bi Binh Thuan,BST - Cong ty Co phan Sach va Thiet bi Binh Thuan
BT6,Cong ty Co phan BETON 6,BT6 - Cong ty Co phan BETON 6
BTG,Cong ty Co phan Bao bi Tien Giang,BTG - Cong ty Co phan Bao bi Tien Giang
BTH,Cong ty Co phan Che tao Bien the va Vat lieu Dien Ha Noi,BTH - Cong ty Co phan Che tao Bien the va Vat lieu Dien Ha Noi
BTN,Cong ty Co phan Gach Tuy Nen Binh Dinh,BTN - Cong ty Co phan Gach Tuy Nen Binh Dinh
BTP,Cong ty Co phan Nhiet dien Ba Ria,BTP - Cong ty Co phan Nhiet dien Ba Ria
BTS,Cong ty Co phan Xi mang VICEM But Son,BTS - Cong ty Co phan Xi mang VICEM But Son
BTT,Cong ty Co phan Thuong mai - Dich vu Ben Thanh,BTT - Cong ty Co phan Thuong mai - Dich vu Ben Thanh
BTD,Cong ty Co phan Be tong ly tam Thu Duc,BTD - Cong ty Co phan Be tong ly tam Thu Duc
BTV,Cong ty Co phan Dich vu Du lich Ben Thanh,BTV - Cong ty Co phan Dich vu Du lich Ben Thanh
BTU,Cong ty Co phan Cong trinh Do thi Ben Tre,BTU - Cong ty Co phan Cong trinh Do thi Ben Tre
BTW,Cong ty Co phan Cap nuoc Ben Thanh,BTW - Cong ty Co phan Cap nuoc Ben Thanh
BLN,Cong ty Co phan Van tai va Dich vu Lien Ninh,BLN - Cong ty Co phan Van tai va Dich vu Lien Ninh
BVG,Cong ty co phan Group Bac Viet,BVG - Cong ty co phan Group Bac Viet
BVH,Tap doan Bao Viet,BVH - Tap doan Bao Viet
BVN,Cong ty Co phan Bong Viet Nam,BVN - Cong ty Co phan Bong Viet Nam
TNH,Cong ty Co phan Benh vien Quoc te Thai Nguyen,TNH - Cong ty Co phan Benh vien Quoc te Thai Nguyen
BVS,Cong ty Co phan Chung khoan Bao Viet,BVS - Cong ty Co phan Chung khoan Bao Viet
BWA,Cong ty Co phan Cap thoat nuoc va Xay dung Bao Loc,BWA - Cong ty Co phan Cap thoat nuoc va Xay dung Bao Loc
BWS,Cong ty Co phan Cap Nuoc Ba Ria - Vung Tau,BWS - Cong ty Co phan Cap Nuoc Ba Ria - Vung Tau
BXH,Cong ty Co phan VICEM Bao bi Hai Phong,BXH - Cong ty Co phan VICEM Bao bi Hai Phong
HNB,Cong ty Co phan Ben xe Ha Noi,HNB - Cong ty Co phan Ben xe Ha Noi
C69,Cong ty Co phan Xay dung 1369,C69 - Cong ty Co phan Xay dung 1369
C21,Cong ty Co phan The ky 21,C21 - Cong ty Co phan The ky 21
C22,Cong ty Co phan 22,C22 - Cong ty Co phan 22
C32,Cong ty Co phan CIC39,C32 - Cong ty Co phan CIC39
C47,Cong ty Co phan Xay dung 47,C47 - Cong ty Co phan Xay dung 47
C71,Cong ty Co phan 471,C71 - Cong ty Co phan 471
TS3,Cong ty Co phan Truong Son 532,TS3 - Cong ty Co phan Truong Son 532
C92,Cong ty Co phan Xay dung va Dau tu 492,C92 - Cong ty Co phan Xay dung va Dau tu 492
CAD,Cong ty Co phan Che bien va Xuat khau Thuy san Cadovimex,CAD - Cong ty Co phan Che bien va Xuat khau Thuy san Cadovimex
CPA,Cong ty Co phan Ca phe Phuoc An,CPA - Cong ty Co phan Ca phe Phuoc An
CFV,Cong ty Co phan Ca phe Thang Loi,CFV - Cong ty Co phan Ca phe Thang Loi
CAN,Cong ty Co phan Do hop Ha Long,CAN - Cong ty Co phan Do hop Ha Long
CCT,Cong ty Co phan Cang Can Tho,CCT - Cong ty Co phan Cang Can Tho
CAP,Cong ty Co phan Lam Nong san Thuc pham Yen Bai,CAP - Cong ty Co phan Lam Nong san Thuc pham Yen Bai
CCA,Cong ty Co phan Xuat nhap khau Thuy san Can Tho,CCA - Cong ty Co phan Xuat nhap khau Thuy san Can Tho
HFB,Cong ty Co phan Cong trinh Cau pha Thanh pho Ho Chi Minh,HFB - Cong ty Co phan Cong trinh Cau pha Thanh pho Ho Chi Minh
CAV,Cong ty Co phan Day cap dien Viet Nam,CAV - Cong ty Co phan Day cap dien Viet Nam
CMW,Cong ty Co phan Cap nuoc Ca Mau,CMW - Cong ty Co phan Cap nuoc Ca Mau
KCB,Cong ty Co phan Khoang San va Luyen Kim Cao Bang,KCB - Cong ty Co phan Khoang San va Luyen Kim Cao Bang
CBS,Cong ty Co phan Mia duong Cao Bang,CBS - Cong ty Co phan Mia duong Cao Bang
CCI,Cong ty Co phan Dau tu Phat trien Cong nghiep Thuong mai Cu Chi,CCI - Cong ty Co phan Dau tu Phat trien Cong nghiep Thuong mai Cu Chi
CCL,Cong ty Co phan Dau tu va Phat trien Do thi Dau khi Cuu Long,CCL - Cong ty Co phan Dau tu va Phat trien Do thi Dau khi Cuu Long
VSM,Cong ty Co phan Container Mien Trung,VSM - Cong ty Co phan Container Mien Trung
CCM,Cong ty Co phan Khoang san va Xi mang Can Tho,CCM - Cong ty Co phan Khoang san va Xi mang Can Tho
CCR,Cong ty Co phan Cang Cam Ranh,CCR - Cong ty Co phan Cang Cam Ranh
CDC,Cong ty Co phan Chuong Duong,CDC - Cong ty Co phan Chuong Duong
CDH,Cong ty Co phan Cong trinh Cong cong va Dich vu Du lich Hai Phong,CDH - Cong ty Co phan Cong trinh Cong cong va Dich vu Du lich Hai Phong
CDG,Cong ty Co phan Cau Duong,CDG - Cong ty Co phan Cau Duong
CDO,Cong ty Co phan Tu van Thiet ke va Phat trien Do thi,CDO - Cong ty Co phan Tu van Thiet ke va Phat trien Do thi
CEN,Cong ty Co phan CENCON Viet Nam,CEN - Cong ty Co phan CENCON Viet Nam
CRE,Cong ty Co phan Bat dong san The Ky,CRE - Cong ty Co phan Bat dong san The Ky
STK,Cong ty Co phan Soi The Ky,STK - Cong ty Co phan Soi The Ky
CEO,Cong ty Co phan Tap doan C.E.O,CEO - Cong ty Co phan Tap doan C.E.O
TW3,Cong ty Co phan Duoc Trung Uong 3,TW3 - Cong ty Co phan Duoc Trung Uong 3
CFM,Cong ty Co phan Dau tu CFM,CFM - Cong ty Co phan Dau tu CFM
CH5,Cong ty Co phan Xay dung so 5 Ha Noi,CH5 - Cong ty Co phan Xay dung so 5 Ha Noi
CHC,Cong ty Co phan Cam Ha,CHC - Cong ty Co phan Cam Ha
CLX,Cong ty Co phan Xuat nhap khau va Dau tu Cho Lon (CHOLIMEX),CLX - Cong ty Co phan Xuat nhap khau va Dau tu Cho Lon (CHOLIMEX)
CHP,Cong ty Co phan Thuy dien Mien Trung,CHP - Cong ty Co phan Thuy dien Mien Trung
CI5,Cong ty Co phan Dau tu Xay dung so 5,CI5 - Cong ty Co phan Dau tu Xay dung so 5
CID,Cong ty Co phan Xay dung va Phat trien Co so Ha tang,CID - Cong ty Co phan Xay dung va Phat trien Co so Ha tang
CE1,Cong ty Co phan Xay dung va Thiet bi Cong nghiep CIE1,CE1 - Cong ty Co phan Xay dung va Thiet bi Cong nghiep CIE1
CEG,Cong ty Co phan Tap doan Xay dung va Thiet bi Cong nghiep,CEG - Cong ty Co phan Tap doan Xay dung va Thiet bi Cong nghiep
C4G,Cong ty Co phan Tap Doan Cienco4,C4G - Cong ty Co phan Tap Doan Cienco4
C12,Cong ty Co phan Cau 12,C12 - Cong ty Co phan Cau 12
CIG,Cong ty Co phan COMA 18,CIG - Cong ty Co phan COMA 18
CII,Cong ty Co phan Dau tu Ha tang Ky thuat Thanh pho Ho Chi Minh,CII - Cong ty Co phan Dau tu Ha tang Ky thuat Thanh pho Ho Chi Minh
CKG,Cong ty Co phan Tap doan Tu van Dau tu Xay dung Kien Giang,CKG - Cong ty Co phan Tap doan Tu van Dau tu Xay dung Kien Giang
CIP,Cong ty Co phan Xay lap va San xuat Cong nghiep,CIP - Cong ty Co phan Xay lap va San xuat Cong nghiep
CBI,Cong ty Co phan Gang thep Cao Bang,CBI - Cong ty Co phan Gang thep Cao Bang
CJC,Cong ty Co phan Co dien Mien Trung,CJC - Cong ty Co phan Co dien Mien Trung
CK8,Cong ty Co phan Co khi 120,CK8 - Cong ty Co phan Co khi 120
CKD,Cong ty Co phan Co khi Dong Anh Licogi,CKD - Cong ty Co phan Co khi Dong Anh Licogi
CMK,Cong ty Co phan Co khi Mao Khe - Vinacomin,CMK - Cong ty Co phan Co khi Mao Khe - Vinacomin
CKV,Cong ty Co phan CokyVina,CKV - Cong ty Co phan CokyVina
CLC,Cong ty Co phan Cat Loi,CLC - Cong ty Co phan Cat Loi
ADG,Cong ty Co phan Clever Group,ADG - Cong ty Co phan Clever Group
CLG,Cong ty Co phan Dau tu va Phat trien Nha dat Cotec,CLG - Cong ty Co phan Dau tu va Phat trien Nha dat Cotec
CLL,Cong ty Co phan Cang Cat Lai,CLL - Cong ty Co phan Cang Cat Lai
CMF,Cong ty Co phan Thuc pham Cholimex,CMF - Cong ty Co phan Thuc pham Cholimex
CLW,Cong ty Co phan Cap nuoc Cho Lon,CLW - Cong ty Co phan Cap nuoc Cho Lon
TVH,Cong ty Co phan Tu van Xay dung cong trinh Hang hai,TVH - Cong ty Co phan Tu van Xay dung cong trinh Hang hai
CMC,Cong ty Co phan Dau tu CMC,CMC - Cong ty Co phan Dau tu CMC
MCT,Cong ty Co phan Kinh doanh Vat tu va Xay dung,MCT - Cong ty Co phan Kinh doanh Vat tu va Xay dung
TIN,Cong ty Tai chinh Co phan Tin Viet,TIN - Cong ty Tai chinh Co phan Tin Viet
CMG,Cong ty Co phan Tap doan Cong nghe CMC,CMG - Cong ty Co phan Tap doan Cong nghe CMC
CMI,Cong ty Co phan CMISTONE Viet Nam,CMI - Cong ty Co phan CMISTONE Viet Nam
CMD,Cong ty Co phan Vat lieu xay dung va Trang tri noi that TP Ho Chi Minh,CMD - Cong ty Co phan Vat lieu xay dung va Trang tri noi that TP Ho Chi Minh
CMP,Cong ty Co phan Cang Chan May,CMP - Cong ty Co phan Cang Chan May
CMS,Cong ty Co phan Tap doan CMH Viet Nam,CMS - Cong ty Co phan Tap doan CMH Viet Nam
CAT,Cong ty Co phan Thuy san Ca Mau,CAT - Cong ty Co phan Thuy san Ca Mau
CMT,Cong ty Co phan Cong nghe mang va Truyen thong,CMT - Cong ty Co phan Cong nghe mang va Truyen thong
CMV,Cong ty Co phan Thuong nghiep Ca Mau,CMV - Cong ty Co phan Thuong nghiep Ca Mau
CMX,Cong ty Co phan CAMIMEX Group,CMX - Cong ty Co phan CAMIMEX Group
CNC,Cong ty Co phan Cong nghe cao Traphaco,CNC - Cong ty Co phan Cong nghe cao Traphaco
CNG,Cong ty Co phan CNG Viet Nam,CNG - Cong ty Co phan CNG Viet Nam
CNT,Cong ty Co phan Tap doan CNT,CNT - Cong ty Co phan Tap doan CNT
CC1,Tong Cong ty Xay dung so 1 - CTCP,CC1 - Tong Cong ty Xay dung so 1 - CTCP
CDP,Cong ty Co phan Duoc pham Trung uong Codupha,CDP - Cong ty Co phan Duoc pham Trung uong Codupha
COM,Cong ty Co phan Vat tu Xang dau,COM - Cong ty Co phan Vat tu Xang dau
TCK,Tong Cong ty Co khi Xay dung - CTCP,TCK - Tong Cong ty Co khi Xay dung - CTCP
CMN,Cong ty Co phan Luong thuc Thuc pham Colusa - Miliket,CMN - Cong ty Co phan Luong thuc Thuc pham Colusa - Miliket
ICN,Cong ty Co phan Dau tu Xay dung Dau khi IDICO,ICN - Cong ty Co phan Dau tu Xay dung Dau khi IDICO
CNN,"Cong ty Co phan Tu van Cong nghe, Thiet bi va Kiem dinh Xay dung - CONINCO","CNN - Cong ty Co phan Tu van Cong nghe, Thiet bi va Kiem dinh Xay dung - CONINCO"
CPC,Cong ty Co phan Thuoc sat trung Can Tho,CPC - Cong ty Co phan Thuoc sat trung Can Tho
DP1,Cong ty Co phan Duoc pham Trung uong CPC1,DP1 - Cong ty Co phan Duoc pham Trung uong CPC1
DTP,Cong ty Co phan Duoc pham CPC1 Ha Noi,DTP - Cong ty Co phan Duoc pham CPC1 Ha Noi
CPH,Cong ty Co phan Phuc vu Mai tang Hai Phong,CPH - Cong ty Co phan Phuc vu Mai tang Hai Phong
CPI,Cong ty Co phan Dau tu Cang Cai Lan,CPI - Cong ty Co phan Dau tu Cang Cai Lan
CIA,Cong ty Co Phan Dich Vu San Bay Quoc Te Cam Ranh,CIA - Cong ty Co Phan Dich Vu San Bay Quoc Te Cam Ranh
CRC,Cong ty Co phan Create Capital Viet Nam,CRC - Cong ty Co phan Create Capital Viet Nam
CSC,Cong ty Co phan Tap doan COTANA,CSC - Cong ty Co phan Tap doan COTANA
SGP,Cong ty Co phan Cang Sai Gon,SGP - Cong ty Co phan Cang Sai Gon
CSM,Cong ty Co phan Cong nghiep Cao su Mien Nam,CSM - Cong ty Co phan Cong nghiep Cao su Mien Nam
CSV,Cong ty Co phan Hoa chat Co ban mien Nam,CSV - Cong ty Co phan Hoa chat Co ban mien Nam
CT3,Cong ty Co phan Dau tu va Xay dung cong trinh 3,CT3 - Cong ty Co phan Dau tu va Xay dung cong trinh 3
CT6,Cong ty Co phan Cong trinh 6,CT6 - Cong ty Co phan Cong trinh 6
CTA,Cong ty Co phan Vinavico,CTA - Cong ty Co phan Vinavico
CTB,Cong ty Co phan Che tao Bom Hai Duong,CTB - Cong ty Co phan Che tao Bom Hai Duong
CTC,Cong ty Co phan Tap doan Hoang Kim Tay Nguyen,CTC - Cong ty Co phan Tap doan Hoang Kim Tay Nguyen
CTD,Cong ty Co phan Xay dung Coteccons,CTD - Cong ty Co phan Xay dung Coteccons
CTF,Cong ty Co phan City Auto,CTF - Cong ty Co phan City Auto
CTG,Ngan hang Thuong mai Co phan Cong thuong Viet Nam,CTG - Ngan hang Thuong mai Co phan Cong thuong Viet Nam
GTS,Cong ty Co phan Cong trinh Giao thong Sai Gon,GTS - Cong ty Co phan Cong trinh Giao thong Sai Gon
CTI,Cong ty Co phan Dau tu Phat trien Cuong Thuan IDICO,CTI - Cong ty Co phan Dau tu Phat trien Cuong Thuan IDICO
ICT,Cong ty Co phan Vien thong - Tin hoc Buu dien,ICT - Cong ty Co phan Vien thong - Tin hoc Buu dien
CTN,Cong ty Co phan Xay dung Cong trinh ngam,CTN - Cong ty Co phan Xay dung Cong trinh ngam
