symbol,company_name,company
HLR,Cong ty Co phan Duong sat Ha Lang,HLR - Cong ty Co phan Duong sat Ha Lang
HLS,Cong ty Co phan Su ky thuat Hoang Lien Son,HLS - Cong ty Co phan Su ky thuat Hoang Lien Son
HLY,Cong ty Co phan Gom Xay Dung Yen Hung,HLY - Cong ty Co phan Gom Xay Dung Yen Hung
HMC,Cong ty Co phan Kim khi Thanh pho Ho Chi Minh - VNSTEEL,HMC - Cong ty Co phan Kim khi Thanh pho Ho Chi Minh - VNSTEEL
HMS,Cong ty Co phan Xay dung Bao tang Ho Chi Minh,HMS - Cong ty Co phan Xay dung Bao tang Ho Chi Minh
HMG,Cong ty Co phan Kim Khi Ha Noi - VNSTEEL,HMG - Cong ty Co phan Kim Khi Ha Noi - VNSTEEL
HMH,Cong ty Co phan Hai Minh,HMH - Cong ty Co phan Hai Minh
BKH,Cong ty Co phan Banh mut keo Ha Noi,BKH - Cong ty Co phan Banh mut keo Ha Noi
DCH,Cong ty Co phan Dia chinh Ha Noi,DCH - Cong ty Co phan Dia chinh Ha Noi
HAF,Cong ty Co phan Thuc pham Ha Noi,HAF - Cong ty Co phan Thuc pham Ha Noi
HNG,Cong ty Co phan Nong nghiep Quoc te Hoang Anh Gia Lai,HNG - Cong ty Co phan Nong nghiep Quoc te Hoang Anh Gia Lai
HNA,Cong ty Co phan Thuy dien Hua Na,HNA - Cong ty Co phan Thuy dien Hua Na
HNM,Cong ty Co phan Sua Ha Noi,HNM - Cong ty Co phan Sua Ha Noi
DHN,Cong ty Co phan Duoc pham Ha Noi,DHN - Cong ty Co phan Duoc pham Ha Noi
HRT,Cong ty Co phan Van tai duong sat Ha Noi,HRT - Cong ty Co phan Van tai duong sat Ha Noi
TSJ,Cong ty Co phan Du lich Dich vu Ha Noi,TSJ - Cong ty Co phan Du lich Dich vu Ha Noi
HJC,Cong ty Co phan Hoa Viet,HJC - Cong ty Co phan Hoa Viet
HOM,Cong ty Co phan Xi mang VICEM Hoang Mai,HOM - Cong ty Co phan Xi mang VICEM Hoang Mai
HOT,Cong ty Co phan Du lich - Dich vu Hoi An,HOT - Cong ty Co phan Du lich - Dich vu Hoi An
HPB,Cong ty Co phan Bao bi PP,HPB - Cong ty Co phan Bao bi PP
HAC,Cong ty Co phan Chung khoan Hai Phong,HAC - Cong ty Co phan Chung khoan Hai Phong
CCP,Cong ty Co phan Cang Cua Cam Hai Phong,CCP - Cong ty Co phan Cang Cua Cam Hai Phong
HPD,Cong ty Co phan Thuy dien Dak Doa,HPD - Cong ty Co phan Thuy dien Dak Doa
HPG,Cong ty Co phan Tap doan Hoa Phat,HPG - Cong ty Co phan Tap doan Hoa Phat
HPH,Cong ty Co phan Hoa Chat Hung Phat Ha Bac,HPH - Cong ty Co phan Hoa Chat Hung Phat Ha Bac
HPM,Cong ty Co phan Xay dung Thuong mai va Khoang san Hoang Phuc,HPM - Cong ty Co phan Xay dung Thuong mai va Khoang san Hoang Phuc
HPP,Cong ty Co phan Son Hai Phong,HPP - Cong ty Co phan Son Hai Phong
DPH,Cong ty Co phan Duoc pham Hai Phong,DPH - Cong ty Co phan Duoc pham Hai Phong
HPT,Cong ty Co phan Dich vu Cong nghe Tin hoc HPT,HPT - Cong ty Co phan Dich vu Cong nghe Tin hoc HPT
TUG,Cong ty Co phan Lai dat va Van tai Cang Hai Phong,TUG - Cong ty Co phan Lai dat va Van tai Cang Hai Phong
HPW,Cong ty Co phan Cap nuoc Hai Phong,HPW - Cong ty Co phan Cap nuoc Hai Phong
HQC,Cong ty Co phan Tu van - Thuong mai - Dich vu Dia oc Hoang Quan,HQC - Cong ty Co phan Tu van - Thuong mai - Dich vu Dia oc Hoang Quan
HRB,Cong ty Co phan Harec Dau tu va Thuong Mai,HRB - Cong ty Co phan Harec Dau tu va Thuong Mai
HRC,Cong ty Co phan Cao su Hoa Binh,HRC - Cong ty Co phan Cao su Hoa Binh
HSA,Cong ty Co phan HESTIA,HSA - Cong ty Co phan HESTIA
HSG,Cong ty Co phan Tap doan Hoa Sen,HSG - Cong ty Co phan Tap doan Hoa Sen
HSI,Cong ty Co phan Vat tu Tong hop va Phan bon Hoa sinh,HSI - Cong ty Co phan Vat tu Tong hop va Phan bon Hoa sinh
HSP,Cong ty Co phan Son Tong hop Ha Noi,HSP - Cong ty Co phan Son Tong hop Ha Noi
HT1,Cong ty Co phan Xi mang VICEM Ha Tien,HT1 - Cong ty Co phan Xi mang VICEM Ha Tien
HTC,Cong ty Co phan Thuong mai Hoc Mon,HTC - Cong ty Co phan Thuong mai Hoc Mon
HTG,Tong Cong ty Co phan Det may Hoa Tho,HTG - Tong Cong ty Co phan Det may Hoa Tho
HTI,Cong ty Co phan Dau tu Phat trien Ha tang IDICO,HTI - Cong ty Co phan Dau tu Phat trien Ha tang IDICO
HTN,Cong ty Co phan Hung Thinh Incons,HTN - Cong ty Co phan Hung Thinh Incons
HTL,Cong ty Co phan Ky thuat va O to Truong Long,HTL - Cong ty Co phan Ky thuat va O to Truong Long
HTP,Cong ty Co phan In Sach Giao Khoa Hoa Phat,HTP - Cong ty Co phan In Sach Giao Khoa Hoa Phat
HTR,Cong ty Co phan Duong sat Ha Thai,HTR - Cong ty Co phan Duong sat Ha Thai
HTT,Cong ty Co phan Thuong mai Ha Tay,HTT - Cong ty Co phan Thuong mai Ha Tay
HTV,Cong ty Co phan Logistics Vicem,HTV - Cong ty Co phan Logistics Vicem
HU1,Cong ty Co phan Dau tu va Xay dung HUD1,HU1 - Cong ty Co phan Dau tu va Xay dung HUD1
HU3,Cong ty Co phan Dau tu va Xay dung HUD3,HU3 - Cong ty Co phan Dau tu va Xay dung HUD3
HU4,Cong ty Co phan Dau tu va Xay dung HUD4,HU4 - Cong ty Co phan Dau tu va Xay dung HUD4
HD2,Cong ty Co phan Dau tu phat trien nha HUD2,HD2 - Cong ty Co phan Dau tu phat trien nha HUD2
HU6,Cong ty Co phan Dau tu Phat trien Nha va Do thi HUD6,HU6 - Cong ty Co phan Dau tu Phat trien Nha va Do thi HUD6
HD8,Cong ty Co phan Dau tu Phat trien Nha va Do thi HUD8,HD8 - Cong ty Co phan Dau tu Phat trien Nha va Do thi HUD8
HWS,Cong ty Co phan Cap nuoc Thua Thien Hue,HWS - Cong ty Co phan Cap nuoc Thua Thien Hue
HNI,Cong ty Co phan May Huu Nghi,HNI - Cong ty Co phan May Huu Nghi
HUG,Tong cong ty May Hung Yen - Cong ty Co phan,HUG - Tong cong ty May Hung Yen - Cong ty Co phan
HUT,Cong ty Co phan Tasco,HUT - Cong ty Co phan Tasco
HNF,Cong ty Co phan Thuc pham Huu Nghi,HNF - Cong ty Co phan Thuc pham Huu Nghi
HVA,Cong ty Co phan Dau tu HVA,HVA - Cong ty Co phan Dau tu HVA
HVH,Cong ty Co phan Dau tu va Cong nghe HVC,HVH - Cong ty Co phan Dau tu va Cong nghe HVC
HVG,Cong ty Co phan Hung Vuong,HVG - Cong ty Co phan Hung Vuong
HVT,Cong ty Co phan Hoa chat Viet Tri,HVT - Cong ty Co phan Hoa chat Viet Tri
HVX,Cong ty Co phan Xi mang Vicem Hai Van,HVX - Cong ty Co phan Xi mang Vicem Hai Van
L40,Cong ty Co phan Dau tu va Xay dung 40,L40 - Cong ty Co phan Dau tu va Xay dung 40
IBC,Cong ty Co phan Dau tu APAX Holdings,IBC - Cong ty Co phan Dau tu APAX Holdings
ICC,Cong ty Co phan Xay dung cong nghiep,ICC - Cong ty Co phan Xay dung cong nghiep
ILB,Cong ty Co phan ICD Tan Cang - Long Binh,ILB - Cong ty Co phan ICD Tan Cang - Long Binh
ICF,Cong ty Co phan Dau tu-Thuong mai-Thuy san,ICF - Cong ty Co phan Dau tu-Thuong mai-Thuy san
ICG,Cong ty Co phan Xay dung Song Hong,ICG - Cong ty Co phan Xay dung Song Hong
ICI,Cong ty Co phan Dau tu va Xay dung Cong nghiep,ICI - Cong ty Co phan Dau tu va Xay dung Cong nghiep
CC4,Cong ty Co phan Dau tu va Xay dung so 4,CC4 - Cong ty Co phan Dau tu va Xay dung so 4
IDI,Cong ty Co phan Dau tu va Phat trien Da Quoc Gia I.D.I,IDI - Cong ty Co phan Dau tu va Phat trien Da Quoc Gia I.D.I
IDC,Tong Cong ty IDICO - CTCP,IDC - Tong Cong ty IDICO - CTCP
MCI,Cong ty Co phan Dau tu Xay dung va Phat trien Vat lieu IDICO,MCI - Cong ty Co phan Dau tu Xay dung va Phat trien Vat lieu IDICO
IDJ,Cong ty Co phan Dau tu IDJ Viet Nam,IDJ - Cong ty Co phan Dau tu IDJ Viet Nam
IDP,Cong ty Co phan Sua Quoc te,IDP - Cong ty Co phan Sua Quoc te
IDV,Cong ty Co phan Phat trien Ha tang Vinh Phuc,IDV - Cong ty Co phan Phat trien Ha tang Vinh Phuc
IFS,Cong ty Co phan Thuc pham Quoc te,IFS - Cong ty Co phan Thuc pham Quoc te
IHK,Cong ty Co phan In Hang Khong,IHK - Cong ty Co phan In Hang Khong
IJC,Cong ty Co phan Phat trien Ha tang Ky thuat,IJC - Cong ty Co phan Phat trien Ha tang Ky thuat
ILA,Cong ty Co phan ILA,ILA - Cong ty Co phan ILA
ILC,Cong ty Co phan Hop tac lao dong voi nuoc ngoai,ILC - Cong ty Co phan Hop tac lao dong voi nuoc ngoai
IME,Cong ty Co phan Co khi va Xay lap Cong nghiep,IME - Cong ty Co phan Co khi va Xay lap Cong nghiep
IMP,Cong ty Co phan Duoc pham IMEXPHARM,IMP - Cong ty Co phan Duoc pham IMEXPHARM
IN4,Cong ty Co phan In so 4,IN4 - Cong ty Co phan In so 4
IBD,Cong ty Co phan In Tong hop Binh Duong,IBD - Cong ty Co phan In Tong hop Binh Duong
INC,Cong ty Co phan Tu van Dau tu IDICO,INC - Cong ty Co phan Tu van Dau tu IDICO
DDG,Cong ty Co phan Dau tu Cong nghiep Xuat nhap khau Dong Duong,DDG - Cong ty Co phan Dau tu Cong nghiep Xuat nhap khau Dong Duong
INN,Cong ty Co phan Bao bi va In Nong nghiep,INN - Cong ty Co phan Bao bi va In Nong nghiep
IRC,Cong ty Co phan Cao su Cong nghiep,IRC - Cong ty Co phan Cao su Cong nghiep
ILS,Cong ty Co phan Dau tu Thuong mai va Dich vu Quoc te,ILS - Cong ty Co phan Dau tu Thuong mai va Dich vu Quoc te
IPA,Cong ty Co phan Tap doan Dau tu I.P.A,IPA - Cong ty Co phan Tap doan Dau tu I.P.A
ISG,Cong ty Co phan Van tai bien va Hop tac lao dong Quoc Te,ISG - Cong ty Co phan Van tai bien va Hop tac lao dong Quoc Te
IST,Cong ty Co phan ICD Tan Cang Song Than,IST - Cong ty Co phan ICD Tan Cang Song Than
ITA,Cong ty Co phan Dau tu va Cong nghiep Tan Tao,ITA - Cong ty Co phan Dau tu va Cong nghiep Tan Tao
ITS,"Cong ty Co phan Dau tu, Thuong mai va Dich vu - Vinacomin","ITS - Cong ty Co phan Dau tu, Thuong mai va Dich vu - Vinacomin"
ITC,Cong ty Co phan Dau tu - Kinh doanh nha,ITC - Cong ty Co phan Dau tu - Kinh doanh nha
ITD,Cong ty Co phan Cong nghe Tien Phong,ITD - Cong ty Co phan Cong nghe Tien Phong
ITQ,Cong ty Co phan Tap doan Thien Quang,ITQ - Cong ty Co phan Tap doan Thien Quang
IVS,Cong ty Co phan Chung khoan Goutai Junan (Viet Nam),IVS - Cong ty Co phan Chung khoan Goutai Junan (Viet Nam)
JVC,Cong ty Co phan Dau tu va Phat trien Y te Viet Nhat,JVC - Cong ty Co phan Dau tu va Phat trien Y te Viet Nhat
KAC,Cong ty Co phan Dau tu Dia oc Khang An,KAC - Cong ty Co phan Dau tu Dia oc Khang An
KBC,Tong Cong ty Phat trien Do thi Kinh Bac,KBC - Tong Cong ty Phat trien Do thi Kinh Bac
KCE,Cong ty Co phan Be tong Ly tam Dien luc Khanh Hoa,KCE - Cong ty Co phan Be tong Ly tam Dien luc Khanh Hoa
KDC,Cong ty Co phan Tap doan KIDO,KDC - Cong ty Co phan Tap doan KIDO
KDH,Cong ty Co phan Dau tu va Kinh doanh nha Khang Dien,KDH - Cong ty Co phan Dau tu va Kinh doanh nha Khang Dien
KDM,Cong ty Co phan Tap doan GCL,KDM - Cong ty Co phan Tap doan GCL
KTC,Cong ty Co phan Thuong mai Kien Giang,KTC - Cong ty Co phan Thuong mai Kien Giang
KHA,Cong ty Co phan Dau tu va Dich vu Khanh Hoi,KHA - Cong ty Co phan Dau tu va Dich vu Khanh Hoi
KHG,Cong ty Co phan Tap doan Khai Hoan Land,KHG - Cong ty Co phan Tap doan Khai Hoan Land
KHW,Cong ty Co phan Cap thoat nuoc Khanh Hoa,KHW - Cong ty Co phan Cap thoat nuoc Khanh Hoa
KHL,Cong ty Co phan Khoang san va Vat lieu Xay dung Hung Long,KHL - Cong ty Co phan Khoang san va Vat lieu Xay dung Hung Long
KHP,Cong ty Co phan Dien luc Khanh Hoa,KHP - Cong ty Co phan Dien luc Khanh Hoa
KGM,Cong ty Co phan Xuat nhap khau Kien Giang,KGM - Cong ty Co phan Xuat nhap khau Kien Giang
KHS,Cong ty Co phan Kien Hung,KHS - Cong ty Co phan Kien Hung
KKC,Cong ty Co phan Tap doan Thanh Thai,KKC - Cong ty Co phan Tap doan Thanh Thai
KLB,Ngan hang Thuong mai Co phan Kien Long,KLB - Ngan hang Thuong mai Co phan Kien Long
KLF,Cong ty Co phan Dau tu Thuong mai va Xuat nhap khau CFS,KLF - Cong ty Co phan Dau tu Thuong mai va Xuat nhap khau CFS
KLM,Cong ty Co phan Kim loai mau Nghe Tinh,KLM - Cong ty Co phan Kim loai mau Nghe Tinh
GKM,Cong ty Co phan Khang Minh Group,GKM - Cong ty Co phan Khang Minh Group
KMR,Cong ty Co phan Mirae,KMR - Cong ty Co phan Mirae
KMT,Cong ty Co phan Kim khi Mien Trung,KMT - Cong ty Co phan Kim khi Mien Trung
KOS,Cong ty Co phan KOSY,KOS - Cong ty Co phan KOSY
KPF,Cong ty Co phan Dau tu Tai san KOJI,KPF - Cong ty Co phan Dau tu Tai san KOJI
KSB,Cong ty Co phan Khoang san va Xay dung Binh Duong,KSB - Cong ty Co phan Khoang san va Xay dung Binh Duong
KSD,Cong ty Co phan Dau tu DNA,KSD - Cong ty Co phan Dau tu DNA
KSH,Cong ty Co phan Damac GLS,KSH - Cong ty Co phan Damac GLS
KHD,"Cong ty Co phan Khai thac, Che bien Khoang san Hai Duong","KHD - Cong ty Co phan Khai thac, Che bien Khoang san Hai Duong"
KSK,Cong ty Co phan Khoang san luyen kim mau,KSK - Cong ty Co phan Khoang san luyen kim mau
LMC,Cong ty Co phan Long Beach LMC,LMC - Cong ty Co phan Long Beach LMC
KSQ,Cong ty Co phan CNC Capital Viet Nam,KSQ - Cong ty Co phan CNC Capital Viet Nam
KSS,Tong Cong ty Co phan Khoang san Na Ri Hamico,KSS - Tong Cong ty Co phan Khoang san Na Ri Hamico
KST,Cong ty Co phan KASATI,KST - Cong ty Co phan KASATI
KSV,Tong Cong ty Khoang san TKV - Cong ty Co phan,KSV - Tong Cong ty Khoang san TKV - Cong ty Co phan
KTL,Cong ty Co phan Kim khi Thang Long,KTL - Cong ty Co phan Kim khi Thang Long
KTS,Cong ty Co phan Duong Kon Tum,KTS - Cong ty Co phan Duong Kon Tum
KTT,Cong ty Co phan Tap doan Dau tu KTT,KTT - Cong ty Co phan Tap doan Dau tu KTT
KTU,Cong ty Co phan Moi truong Do thi Kon Tum,KTU - Cong ty Co phan Moi truong Do thi Kon Tum
KVC,Cong ty Co phan San xuat Xuat nhap khau Inox Kim Vi,KVC - Cong ty Co phan San xuat Xuat nhap khau Inox Kim Vi
L10,Cong ty Co phan Lilama 10,L10 - Cong ty Co phan Lilama 10
L14,Cong ty Co phan Licogi 14,L14 - Cong ty Co phan Licogi 14
L18,Cong ty Co phan Dau tu va Xay dung so 18,L18 - Cong ty Co phan Dau tu va Xay dung so 18
L35,Cong ty Co phan Co khi Lap may Lilama,L35 - Cong ty Co phan Co khi Lap may Lilama
L43,Cong ty Co phan Lilama 45.3,L43 - Cong ty Co phan Lilama 45.3
L44,Cong ty Co phan Lilama 45.4,L44 - Cong ty Co phan Lilama 45.4
L45,Cong ty Co phan Lilama 45.1,L45 - Cong ty Co phan Lilama 45.1
L61,Cong ty Co phan Lilama 69-1,L61 - Cong ty Co phan Lilama 69-1
L62,Cong ty Co phan Lilama 69 - 2,L62 - Cong ty Co phan Lilama 69 - 2
L63,Cong ty Co phan Lilama 69-3,L63 - Cong ty Co phan Lilama 69-3
LAF,Cong ty Co phan Che bien Hang Xuat khau Long An,LAF - Cong ty Co phan Che bien Hang Xuat khau Long An
LMI,Cong ty Co phan Dau tu Xay dung Lap may IDICO,LMI - Cong ty Co phan Dau tu Xay dung Lap may IDICO
DKC,Cong ty Co phan Cho Lang Son,DKC - Cong ty Co phan Cho Lang Son
LSG,Cong ty Co phan Bat dong san Sai Gon Vi na,LSG - Cong ty Co phan Bat dong san Sai Gon Vi na
LAS,Cong ty Co phan Supe Phot phat va Hoa chat Lam Thao,LAS - Cong ty Co phan Supe Phot phat va Hoa chat Lam Thao
LAW,Cong ty Co phan Cap thoat nuoc Long An,LAW - Cong ty Co phan Cap thoat nuoc Long An
LBC,Cong ty Co phan Thuong mai - Dau tu Long Bien,LBC - Cong ty Co phan Thuong mai - Dau tu Long Bien
LBE,Cong ty Co phan Sach va Thiet bi Truong hoc Long An,LBE - Cong ty Co phan Sach va Thiet bi Truong hoc Long An
LBM,Cong ty Co phan Khoang san va Vat lieu xay dung Lam Dong,LBM - Cong ty Co phan Khoang san va Vat lieu xay dung Lam Dong
LCC,Cong ty Co phan Xi mang Hong Phong,LCC - Cong ty Co phan Xi mang Hong Phong
LCD,Cong ty Co phan Lap may - Thi nghiem co dien,LCD - Cong ty Co phan Lap may - Thi nghiem co dien
LCG,Cong ty Co phan Lizen,LCG - Cong ty Co phan Lizen
LQN,Cong ty Co phan Licogi Quang Ngai,LQN - Cong ty Co phan Licogi Quang Ngai
LCM,Cong ty Co phan Khai thac va Che bien Khoang san Lao Cai,LCM - Cong ty Co phan Khai thac va Che bien Khoang san Lao Cai
LCS,Cong ty Co phan Licogi 16.6,LCS - Cong ty Co phan Licogi 16.6
LCW,Cong ty Co phan Nuoc sach Lai Chau,LCW - Cong ty Co phan Nuoc sach Lai Chau
LWS,Cong ty Co phan Cap nuoc Tinh Lao Cai,LWS - Cong ty Co phan Cap nuoc Tinh Lao Cai
LDG,Cong ty Co phan Dau tu LDG,LDG - Cong ty Co phan Dau tu LDG
LDP,Cong ty Co phan Duoc Lam Dong - Ladophar,LDP - Cong ty Co phan Duoc Lam Dong - Ladophar
LDW,Cong ty Co phan Cap thoat nuoc Lam Dong,LDW - Cong ty Co phan Cap thoat nuoc Lam Dong
LGM,Cong ty Co phan Giay da va may mac xuat khau (Legamex),LGM - Cong ty Co phan Giay da va may mac xuat khau (Legamex)
LGC,Cong ty Co phan Dau tu Cau duong CII,LGC - Cong ty Co phan Dau tu Cau duong CII
LGL,Cong ty Co phan Dau tu va Phat trien Do thi Long Giang,LGL - Cong ty Co phan Dau tu va Phat trien Do thi Long Giang
LHC,Cong ty Co phan Dau tu va Xay dung Thuy loi Lam Dong,LHC - Cong ty Co phan Dau tu va Xay dung Thuy loi Lam Dong
LHG,Cong ty Co phan Long Hau,LHG - Cong ty Co phan Long Hau
LIC,Tong Cong ty LICOGI - Cong ty Co phan,LIC - Tong Cong ty LICOGI - Cong ty Co phan
L12,Cong ty Co phan Licogi 12,L12 - Cong ty Co phan Licogi 12
LG9,Cong ty Co phan Co gioi va Xay lap so 9,LG9 - Cong ty Co phan Co gioi va Xay lap so 9
LIG,Cong ty Co phan Licogi 13,LIG - Cong ty Co phan Licogi 13
LLM,Tong Cong ty lap may Viet Nam - Cong ty Co phan,LLM - Tong Cong ty lap may Viet Nam - Cong ty Co phan
LAI,Cong ty Co phan Dau tu Xay dung Long An IDICO,LAI - Cong ty Co phan Dau tu Xay dung Long An IDICO
AMS,Cong ty Co phan Co khi Xay dung AMECC,AMS - Cong ty Co phan Co khi Xay dung AMECC
LIX,Cong ty Co phan Bot giat LIX,LIX - Cong ty Co phan Bot giat LIX
LKW,Cong ty Co phan Cap nuoc Long Khanh,LKW - Cong ty Co phan Cap nuoc Long Khanh
LM3,Cong ty Co phan Lilama 3,LM3 - Cong ty Co phan Lilama 3
LM7,Cong ty Co phan Lilama 7,LM7 - Cong ty Co phan Lilama 7
LM8,Cong ty Co phan Lilama 18,LM8 - Cong ty Co phan Lilama 18
LMH,Cong ty Co phan Quoc Te Holding,LMH - Cong ty Co phan Quoc Te Holding
LNC,Cong ty Co phan Le Ninh,LNC - Cong ty Co phan Le Ninh
LO5,Cong ty Co phan Lilama 5,LO5 - Cong ty Co phan Lilama 5
LSS,Cong ty Co phan Mia duong Lam Son,LSS - Cong ty Co phan Mia duong Lam Son
LTC,Cong ty Co phan Dien nhe Vien Thong,LTC - Cong ty Co phan Dien nhe Vien Thong
LUT,Cong ty Co phan Dau tu Xay dung Luong Tai,LUT - Cong ty Co phan Dau tu Xay dung Luong Tai
LPB,Ngan hang Thuong mai Co phan Buu Dien Lien Viet,LPB - Ngan hang Thuong mai Co phan Buu Dien Lien Viet
MAC,Cong ty Co phan Cung ung va Dich vu Ky thuat Hang Hai,MAC - Cong ty Co phan Cung ung va Dich vu Ky thuat Hang Hai
MA1,Cong ty Co phan Thiet bi,MA1 - Cong ty Co phan Thiet bi
MAS,Cong ty co phan Dich vu Hang Khong San Bay Da Nang,MAS - Cong ty co phan Dich vu Hang Khong San Bay Da Nang
MBB,Ngan hang Thuong mai Co phan Quan doi,MBB - Ngan hang Thuong mai Co phan Quan doi
MCC,Cong ty Co phan Gach ngoi cao cap,MCC - Cong ty Co phan Gach ngoi cao cap
MCF,Cong ty Co phan Xay lap Co khi va Luong thuc Thuc pham,MCF - Cong ty Co phan Xay lap Co khi va Luong thuc Thuc pham
MCG,Cong ty Co phan Nang luong va Bat dong san MCG,MCG - Cong ty Co phan Nang luong va Bat dong san MCG
MCM,Cong ty Co phan Giong bo sua Moc Chau,MCM - Cong ty Co phan Giong bo sua Moc Chau
MCO,Cong ty Co phan Dau tu va Xay dung BDC Viet Nam,MCO - Cong ty Co phan Dau tu va Xay dung BDC Viet Nam
MCP,Cong ty Co phan In va Bao bi My Chau,MCP - Cong ty Co phan In va Bao bi My Chau
MDA,Cong ty Co phan Moi truong Do thi Dong Anh,MDA - Cong ty Co phan Moi truong Do thi Dong Anh
MDC,Cong ty Co phan Than Mong Duong - Vinacomin,MDC - Cong ty Co phan Than Mong Duong - Vinacomin
MDF,Cong ty Co phan Go MDF VRG - Quang Tri,MDF - Cong ty Co phan Go MDF VRG - Quang Tri
MDG,Cong ty Co phan Mien Dong,MDG - Cong ty Co phan Mien Dong
MEC,Cong ty Co phan Co khi - Lap may Song Da,MEC - Cong ty Co phan Co khi - Lap may Song Da
MED,Cong ty Co phan Duoc Trung uong Mediplantex,MED - Cong ty Co phan Duoc Trung uong Mediplantex
MEF,Cong ty Co phan MEINFA,MEF - Cong ty Co phan MEINFA
MEL,Cong ty Co phan Thep Me Lin,MEL - Cong ty Co phan Thep Me Lin
MRF,Cong ty Co phan MERUFA,MRF - Cong ty Co phan MERUFA
MES,Cong ty Co phan Co dien Cong trinh,MES - Cong ty Co phan Co dien Cong trinh
MFS,Cong ty Co phan Dich vu ky thuat Mobifone,MFS - Cong ty Co phan Dich vu ky thuat Mobifone
MHC,Cong ty Co phan MHC,MHC - Cong ty Co phan MHC
JOS,Cong ty Co phan Che bien Thuy san Xuat khau Minh Hai,JOS - Cong ty Co phan Che bien Thuy san Xuat khau Minh Hai
MHL,Cong ty Co phan Minh Huu Lien,MHL - Cong ty Co phan Minh Huu Lien
MIC,Cong ty Co phan Ky nghe Khoang san Quang Nam,MIC - Cong ty Co phan Ky nghe Khoang san Quang Nam
MIE,Tong Cong ty May va Thiet bi Cong nghiep - CTCP,MIE - Tong Cong ty May va Thiet bi Cong nghiep - CTCP
MIM,Cong ty Co phan Khoang san va Co khi,MIM - Cong ty Co phan Khoang san va Co khi
MIG,Tong Cong ty Co phan Bao hiem Quan doi,MIG - Tong Cong ty Co phan Bao hiem Quan doi
MTA,Tong Cong ty Khoang san va Thuong mai Ha Tinh - Cong ty Co phan,MTA - Tong Cong ty Khoang san va Thuong mai Ha Tinh - Cong ty Co phan
MLS,Cong ty Co phan Chan nuoi - Mitraco,MLS - Cong ty Co phan Chan nuoi - Mitraco
MKP,Cong ty Co phan Hoa - Duoc pham Mekophar,MKP - Cong ty Co phan Hoa - Duoc pham Mekophar
MKV,Cong ty Co phan Duoc Thu Y Cai Lay,MKV - Cong ty Co phan Duoc Thu Y Cai Lay
MLC,Cong ty Co phan Moi truong Do thi Tinh Lao Cai,MLC - Cong ty Co phan Moi truong Do thi Tinh Lao Cai
MML,Cong ty Co phan Masan MEATLife,MML - Cong ty Co phan Masan MEATLife
MPC,Cong ty Co phan Tap doan Thuy san Minh Phu,MPC - Cong ty Co phan Tap doan Thuy san Minh Phu
MPT,Cong ty Co phan Tap doan MPT,MPT - Cong ty Co phan Tap doan MPT
MPY,Cong ty Co phan Moi truong do thi Phu Yen,MPY - Cong ty Co phan Moi truong do thi Phu Yen
MQB,Cong ty Co phan Moi truong va Phat trien do thi Quang Binh,MQB - Cong ty Co phan Moi truong va Phat trien do thi Quang Binh
MSB,Ngan hang Thuong mai Co phan Hang Hai Viet Nam,MSB - Ngan hang Thuong mai Co phan Hang Hai Viet Nam
MCH,Cong ty Co phan Hang Tieu Dung MaSan,MCH - Cong ty Co phan Hang Tieu Dung MaSan
MSN,Cong ty Co phan Tap doan Masan,MSN - Cong ty Co phan Tap doan Masan
MSR,Cong ty Co phan Masan High-Tech Materials,MSR - Cong ty Co phan Masan High-Tech Materials
MST,Cong ty Co phan Dau tu MST,MST - Cong ty Co phan Dau tu MST
MTC,Cong ty Co phan Dich vu Du lich My Tra,MTC - Cong ty Co phan Dich vu Du lich My Tra
MTG,Cong ty Co phan MT Gas,MTG - Cong ty Co phan MT Gas
MTH,Cong ty Co phan Moi truong Do thi Ha Dong,MTH - Cong ty Co phan Moi truong Do thi Ha Dong
MTL,Cong ty Co phan Dich vu Moi truong Do thi Tu Liem,MTL - Cong ty Co phan Dich vu Moi truong Do thi Tu Liem
NAU,Cong ty Co phan Moi truong va Cong trinh Do thi Nghe An,NAU - Cong ty Co phan Moi truong va Cong trinh Do thi Nghe An
MTP,Cong ty Co phan Duoc Medipharco,MTP - Cong ty Co phan Duoc Medipharco
MWG,Cong ty Co phan Dau tu The Gioi Di Dong,MWG - Cong ty Co phan Dau tu The Gioi Di Dong
NAB,Ngan hang Thuong mai Co phan Nam a,NAB - Ngan hang Thuong mai Co phan Nam a
NDP,Cong ty Co phan Duoc pham 2/9,NDP - Cong ty Co phan Duoc pham 2/9
NAF,Cong ty Co phan Nafoods Group,NAF - Cong ty Co phan Nafoods Group
NAG,Cong ty Co phan Tap doan Nagakawa,NAG - Cong ty Co phan Tap doan Nagakawa
NJC,Cong ty Co phan May Nam Dinh,NJC - Cong ty Co phan May Nam Dinh
NAC,Cong ty Co phan Tu van Xay dung Tong hop,NAC - Cong ty Co phan Tu van Xay dung Tong hop
FHN,Cong ty Co phan Xuat nhap khau Luong thuc - Thuc pham Ha Noi,FHN - Cong ty Co phan Xuat nhap khau Luong thuc - Thuc pham Ha Noi
NAP,Cong ty Co phan Cang Nghe Tinh,NAP - Cong ty Co phan Cang Nghe Tinh
NTF,Cong ty Co phan Duoc - Vat tu y te Nghe An,NTF - Cong ty Co phan Duoc - Vat tu y te Nghe An
BAB,Ngan hang Thuong mai Co phan Bac a,BAB - Ngan hang Thuong mai Co phan Bac a
NAS,Cong ty Co phan Dich vu Hang khong San bay Noi Bai,NAS - Cong ty Co phan Dich vu Hang khong San bay Noi Bai
NAV,Cong ty Co phan Nam Viet,NAV - Cong ty Co phan Nam Viet
VET,Cong ty Co phan Thuoc Thu y Trung uong NAVETCO,VET - Cong ty Co phan Thuoc Thu y Trung uong NAVETCO
NAW,Cong ty Co phan Cap nuoc Nghe An,NAW - Cong ty Co phan Cap nuoc Nghe An
NBB,Cong ty Co phan Dau tu Nam Bay Bay,NBB - Cong ty Co phan Dau tu Nam Bay Bay
NBC,Cong ty Co phan Than Nui Beo - Vinacomin,NBC - Cong ty Co phan Than Nui Beo - Vinacomin
NBE,Cong ty Co phan Sach va Thiet bi Giao duc Mien Bac,NBE - Cong ty Co phan Sach va Thiet bi Giao duc Mien Bac
NBP,Cong ty Co phan Nhiet Dien Ninh Binh,NBP - Cong ty Co phan Nhiet Dien Ninh Binh
NBW,Cong ty Co phan Cap nuoc Nha Be,NBW - Cong ty Co phan Cap nuoc Nha Be
NCS,Cong ty Co phan Suat an Hang khong Noi Bai,NCS - Cong ty Co phan Suat an Hang khong Noi Bai
NCT,Cong ty Co phan Dich vu Hang hoa Noi Bai,NCT - Cong ty Co phan Dich vu Hang hoa Noi Bai
ND2,Cong ty Co phan Dau tu va Phat trien dien Mien Bac 2,ND2 - Cong ty Co phan Dau tu va Phat trien dien Mien Bac 2
NDC,Cong ty Co phan Nam Duoc,NDC - Cong ty Co phan Nam Duoc
MND,Cong ty Co phan Moi truong Nam Dinh,MND - Cong ty Co phan Moi truong Nam Dinh
NDF,Cong ty Co phan Che bien thuc pham nong san xuat khau Nam Dinh,NDF - Cong ty Co phan Che bien thuc pham nong san xuat khau Nam Dinh
HND,Cong ty Co phan Nhiet dien Hai Phong,HND - Cong ty Co phan Nhiet dien Hai Phong
NDN,Cong ty Co phan Dau tu Phat trien Nha Da Nang,NDN - Cong ty Co phan Dau tu Phat trien Nha Da Nang
NDW,Cong ty Co phan Cap nuoc Nam Dinh,NDW - Cong ty Co phan Cap nuoc Nam Dinh
NDX,Cong ty Co phan Xay lap Phat trien Nha Da Nang,NDX - Cong ty Co phan Xay lap Phat trien Nha Da Nang
NED,Cong ty Co phan Dau tu va Phat trien Dien Tay Bac,NED - Cong ty Co phan Dau tu va Phat trien Dien Tay Bac
NET,Cong ty Co phan Bot giat Net,NET - Cong ty Co phan Bot giat Net
NRC,Cong ty Co phan Tap doan Danh Khoi,NRC - Cong ty Co phan Tap doan Danh Khoi
NFC,Cong ty Co phan Phan lan Ninh Binh,NFC - Cong ty Co phan Phan lan Ninh Binh
NGC,Cong ty Co phan Che bien Thuy san Xuat khau Ngo Quyen,NGC - Cong ty Co phan Che bien Thuy san Xuat khau Ngo Quyen
NHA,Tong Cong ty Dau tu Phat trien Nha va Do thi Nam Ha Noi,NHA - Tong Cong ty Dau tu Phat trien Nha va Do thi Nam Ha Noi
MNB,Tong Cong ty May Nha Be - Cong ty Co phan,MNB - Tong Cong ty May Nha Be - Cong ty Co phan
VCE,Cong ty Co phan Xay lap Moi truong,VCE - Cong ty Co phan Xay lap Moi truong
NHC,Cong ty Co phan Gach ngoi Nhi Hiep,NHC - Cong ty Co phan Gach ngoi Nhi Hiep
NHH,Cong ty Co phan Nhua Ha Noi,NHH - Cong ty Co phan Nhua Ha Noi
VHM,Cong ty Co phan Vinhomes,VHM - Cong ty Co phan Vinhomes
NHP,Cong ty Co phan San xuat Xuat nhap khau NHP,NHP - Cong ty Co phan San xuat Xuat nhap khau NHP
NHT,Cong ty Co phan San xuat va Thuong mai Nam Hoa,NHT - Cong ty Co phan San xuat va Thuong mai Nam Hoa
NHV,Cong ty Co phan Suc khoe Hoi sinh Viet Nam,NHV - Cong ty Co phan Suc khoe Hoi sinh Viet Nam
NKG,Cong ty Co phan Thep Nam Kim,NKG - Cong ty Co phan Thep Nam Kim
NLG,Cong ty co phan Dau tu Nam Long,NLG - Cong ty co phan Dau tu Nam Long
NLS,Cong ty Co phan Cap thoat nuoc Lang Son,NLS - Cong ty Co phan Cap thoat nuoc Lang Son
NNC,Cong ty Co phan Da Nui Nho,NNC - Cong ty Co phan Da Nui Nho
NNG,Cong ty Co phan Cong nghiep - Dich vu - Thuong mai Ngoc Nghia,NNG - Cong ty Co phan Cong nghiep - Dich vu - Thuong mai Ngoc Nghia
