symbol,company_name,company
CTP,Cong ty Co phan Minh Khang Capital Trading Public,CTP - Cong ty Co phan Minh Khang Capital Trading Public
CTR,Tong Cong ty Co phan Cong trinh Viettel,CTR - Tong Cong ty Co phan Cong trinh Viettel
CTS,Cong ty Co phan Chung khoan Ngan hang Cong thuong Viet Nam,CTS - Cong ty Co phan Chung khoan Ngan hang Cong thuong Viet Nam
CTT,Cong ty Co phan Che tao may Vinacomin,CTT - Cong ty Co phan Che tao may Vinacomin
TTS,Cong ty Co phan Can thep Thai Trung,TTS - Cong ty Co phan Can thep Thai Trung
CTW,Cong ty Co phan Cap thoat nuoc Can Tho,CTW - Cong ty Co phan Cap thoat nuoc Can Tho
CTX,Tong Cong ty Co phan Dau tu Xay dung va Thuong mai Viet Nam,CTX - Tong Cong ty Co phan Dau tu Xay dung va Thuong mai Viet Nam
AUM,Cong ty Co phan Vinacafe Son Thanh,AUM - Cong ty Co phan Vinacafe Son Thanh
CVN,Cong ty Co phan Vinam,CVN - Cong ty Co phan Vinam
CVT,Cong ty Co phan CMC,CVT - Cong ty Co phan CMC
CX8,Cong ty Co phan Dau tu va Xay lap Constrexim so 8,CX8 - Cong ty Co phan Dau tu va Xay lap Constrexim so 8
CYC,Cong ty Co phan Gach men Chang Yih,CYC - Cong ty Co phan Gach men Chang Yih
D11,Cong ty Co phan Dia oc 11,D11 - Cong ty Co phan Dia oc 11
D2D,Cong ty Co phan Phat trien Do thi Cong nghiep so 2,D2D - Cong ty Co phan Phat trien Do thi Cong nghiep so 2
DAC,Cong ty Co phan 382 Dong Anh,DAC - Cong ty Co phan 382 Dong Anh
DCR,Cong ty Co phan Gach men COSEVCO,DCR - Cong ty Co phan Gach men COSEVCO
DAD,Cong ty Co phan Dau tu va Phat trien Giao duc Da Nang,DAD - Cong ty Co phan Dau tu va Phat trien Giao duc Da Nang
DAE,Cong ty Co phan Sach Giao duc tai TP.Da Nang,DAE - Cong ty Co phan Sach Giao duc tai TP.Da Nang
DAG,Cong ty Co phan Tap doan Nhua Dong a,DAG - Cong ty Co phan Tap doan Nhua Dong a
DCG,Cong ty Co phan Tong Cong ty May Dap Cau,DCG - Cong ty Co phan Tong Cong ty May Dap Cau
DAH,Cong ty Co phan Tap doan Khach san Dong a,DAH - Cong ty Co phan Tap doan Khach san Dong a
DRG,Cong ty Co phan Cao su Dak Lak,DRG - Cong ty Co phan Cao su Dak Lak
DRI,Cong ty Co phan Dau tu Cao su Dak Lak,DRI - Cong ty Co phan Dau tu Cao su Dak Lak
UDL,Cong ty Co phan Do thi va Moi truong Dak Lak,UDL - Cong ty Co phan Do thi va Moi truong Dak Lak
DWC,Cong ty Co phan Cap nuoc Dak Lak,DWC - Cong ty Co phan Cap nuoc Dak Lak
DHB,Cong ty Co phan Phan dam va Hoa chat Ha Bac,DHB - Cong ty Co phan Phan dam va Hoa chat Ha Bac
ADS,Cong ty Co phan DAMSAN,ADS - Cong ty Co phan DAMSAN
DAN,Cong ty Co phan Duoc Danapha,DAN - Cong ty Co phan Duoc Danapha
DNE,Cong ty Co phan Moi truong Do thi Da Nang,DNE - Cong ty Co phan Moi truong Do thi Da Nang
DAP,Cong ty Co phan Dong a,DAP - Cong ty Co phan Dong a
DAS,Cong ty Co phan May - Thiet bi Dau khi Da Nang,DAS - Cong ty Co phan May - Thiet bi Dau khi Da Nang
DPG,Cong ty Co phan Tap doan Dat Phuong,DPG - Cong ty Co phan Tap doan Dat Phuong
DBC,Cong ty Co phan Tap doan Dabaco Viet Nam,DBC - Cong ty Co phan Tap doan Dabaco Viet Nam
TDB,Cong ty Co phan Thuy dien Dinh Binh,TDB - Cong ty Co phan Thuy dien Dinh Binh
DBM,Cong ty Co phan Duoc - Vat tu Y te Dak Lak,DBM - Cong ty Co phan Duoc - Vat tu Y te Dak Lak
DBT,Cong ty Co phan Duoc pham Ben Tre,DBT - Cong ty Co phan Duoc pham Ben Tre
DC2,Cong ty Co phan Dau tu Phat trien - Xay dung (DIC) so 2,DC2 - Cong ty Co phan Dau tu Phat trien - Xay dung (DIC) so 2
DC4,Cong ty Co phan Xay dung DIC Holdings,DC4 - Cong ty Co phan Xay dung DIC Holdings
DCL,Cong ty Co phan Duoc pham Cuu Long,DCL - Cong ty Co phan Duoc pham Cuu Long
DCM,Cong ty Co phan Phan bon Dau Khi Ca Mau,DCM - Cong ty Co phan Phan bon Dau Khi Ca Mau
DCS,Cong ty Co phan Tap doan Dai Chau,DCS - Cong ty Co phan Tap doan Dai Chau
DCT,Cong ty Co phan Tam lop Vat lieu Xay dung Dong Nai,DCT - Cong ty Co phan Tam lop Vat lieu Xay dung Dong Nai
VBG,Cong ty Co phan Dia chat Viet Bac - TKV,VBG - Cong ty Co phan Dia chat Viet Bac - TKV
DDM,Cong ty Co phan Hang hai Dong Do,DDM - Cong ty Co phan Hang hai Dong Do
DDN,Cong ty Co phan Duoc - Thiet bi y te Da Nang,DDN - Cong ty Co phan Duoc - Thiet bi y te Da Nang
DDV,Cong ty Co phan DAP - Vinachem,DDV - Cong ty Co phan DAP - Vinachem
DCF,Cong ty Co phan Xay dung va Thiet ke so 1,DCF - Cong ty Co phan Xay dung va Thiet ke so 1
DM7,Cong ty Co phan Det may 7,DM7 - Cong ty Co phan Det may 7
DFF,Cong ty Co phan Tap doan Dua Fat,DFF - Cong ty Co phan Tap doan Dua Fat
DGC,Cong ty Co phan Tap doan Hoa chat Duc Giang,DGC - Cong ty Co phan Tap doan Hoa chat Duc Giang
DGT,Cong ty Co phan Cong trinh Giao thong Dong Nai,DGT - Cong ty Co phan Cong trinh Giao thong Dong Nai
DGW,Cong ty Co phan The Gioi So,DGW - Cong ty Co phan The Gioi So
DHA,Cong ty Co phan Hoa An,DHA - Cong ty Co phan Hoa An
DHC,Cong ty Co phan Dong Hai Ben Tre,DHC - Cong ty Co phan Dong Hai Ben Tre
DHG,Cong ty Co phan Duoc Hau Giang,DHG - Cong ty Co phan Duoc Hau Giang
DHM,Cong ty Co phan Thuong mai & Khai thac Khoang san Duong Hieu,DHM - Cong ty Co phan Thuong mai & Khai thac Khoang san Duong Hieu
DHP,Cong ty Co phan Dien co Hai Phong,DHP - Cong ty Co phan Dien co Hai Phong
DHT,Cong ty Co phan Duoc pham Ha Tay,DHT - Cong ty Co phan Duoc pham Ha Tay
DIC,Cong ty Co phan Dau tu va Thuong mai DIC,DIC - Cong ty Co phan Dau tu va Thuong mai DIC
DC1,Cong ty Co phan Dau tu Phat trien Xay dung so 1,DC1 - Cong ty Co phan Dau tu Phat trien Xay dung so 1
DID,Cong ty Co phan DIC - Dong Tien,DID - Cong ty Co phan DIC - Dong Tien
TTE,Cong ty Co phan Dau tu Nang luong Truong Thinh,TTE - Cong ty Co phan Dau tu Nang luong Truong Thinh
DIG,Tong Cong ty Co phan Dau tu Phat trien Xay dung,DIG - Tong Cong ty Co phan Dau tu Phat trien Xay dung
DIH,Cong ty Co phan Dau tu Phat trien Xay dung - Hoi An,DIH - Cong ty Co phan Dau tu Phat trien Xay dung - Hoi An
DL1,Cong ty Co phan Tap doan Alpha Seven,DL1 - Cong ty Co phan Tap doan Alpha Seven
DLD,Cong ty Co phan Du lich Dak Lak,DLD - Cong ty Co phan Du lich Dak Lak
DLG,Cong ty Co phan Tap doan Duc Long Gia Lai,DLG - Cong ty Co phan Tap doan Duc Long Gia Lai
DLM,Cong ty Co phan Chieu sang cong cong Da Nang,DLM - Cong ty Co phan Chieu sang cong cong Da Nang
DLR,Cong ty Co phan Dia oc Da Lat,DLR - Cong ty Co phan Dia oc Da Lat
DUS,Cong ty Co phan Dich vu Do thi Da Lat,DUS - Cong ty Co phan Dich vu Do thi Da Lat
DMC,Cong ty Co phan Xuat nhap khau Y te DOMESCO,DMC - Cong ty Co phan Xuat nhap khau Y te DOMESCO
NSS,Cong ty Co phan Nong suc san Dong Nai,NSS - Cong ty Co phan Nong suc san Dong Nai
DNC,Cong ty Co phan Dien nuoc Lap may Hai Phong,DNC - Cong ty Co phan Dien nuoc Lap may Hai Phong
DNW,Cong ty Co phan Cap nuoc Dong Nai,DNW - Cong ty Co phan Cap nuoc Dong Nai
DNH,Cong ty Co phan Thuy dien Da Nhim - Ham Thuan - Da Mi,DNH - Cong ty Co phan Thuy dien Da Nhim - Ham Thuan - Da Mi
DNL,Cong ty Co phan Logistics Cang Da Nang,DNL - Cong ty Co phan Logistics Cang Da Nang
DNM,Tong Cong ty Co phan Y te Danameco,DNM - Tong Cong ty Co phan Y te Danameco
DND,Cong ty Co phan Dau tu Xay dung va Vat lieu Dong Nai,DND - Cong ty Co phan Dau tu Xay dung va Vat lieu Dong Nai
DNN,Cong ty Co phan Cap nuoc Da Nang,DNN - Cong ty Co phan Cap nuoc Da Nang
DNP,Cong ty Co phan DNP Holding,DNP - Cong ty Co phan DNP Holding
CDN,Cong ty Co phan Cang Da Nang,CDN - Cong ty Co phan Cang Da Nang
DSC,Cong ty Co phan Chung khoan DSC,DSC - Cong ty Co phan Chung khoan DSC
DNT,Cong ty Co phan Du lich Dong Nai,DNT - Cong ty Co phan Du lich Dong Nai
DOC,Cong ty Co phan Vat tu nong nghiep Dong Nai,DOC - Cong ty Co phan Vat tu nong nghiep Dong Nai
MCD,Cong ty Co phan Moi truong va Cong trinh Do thi Dong Ha,MCD - Cong ty Co phan Moi truong va Cong trinh Do thi Dong Ha
BSD,"Cong ty Co phan Bia, Ruou Sai Gon - Dong Xuan","BSD - Cong ty Co phan Bia, Ruou Sai Gon - Dong Xuan"
DMN,Cong ty Co phan Domenal,DMN - Cong ty Co phan Domenal
DOP,Cong ty Co phan Van tai Xang dau Dong Thap,DOP - Cong ty Co phan Van tai Xang dau Dong Thap
CDR,Cong ty Co phan Xay dung Cao su Dong Nai,CDR - Cong ty Co phan Xay dung Cao su Dong Nai
DWS,Cong ty Co phan Cap nuoc va Moi truong Do thi Dong Thap,DWS - Cong ty Co phan Cap nuoc va Moi truong Do thi Dong Thap
DPC,Cong ty Co phan Nhua Da Nang,DPC - Cong ty Co phan Nhua Da Nang
DPM,Tong Cong ty Co phan Phan bon va Hoa chat Dau khi - Cong ty Co phan,DPM - Tong Cong ty Co phan Phan bon va Hoa chat Dau khi - Cong ty Co phan
DPP,Cong ty Co phan Duoc Dong Nai,DPP - Cong ty Co phan Duoc Dong Nai
DPR,Cong ty Co phan Cao su Dong Phu,DPR - Cong ty Co phan Cao su Dong Phu
DPS,Cong ty Co phan Dau tu Phat trien Soc Son,DPS - Cong ty Co phan Dau tu Phat trien Soc Son
DP2,Cong ty Co phan Duoc pham Trung uong 2,DP2 - Cong ty Co phan Duoc pham Trung uong 2
DQC,Cong ty Co phan Bong den Dien Quang,DQC - Cong ty Co phan Bong den Dien Quang
DRC,Cong ty Co phan Cao su Da Nang,DRC - Cong ty Co phan Cao su Da Nang
DRH,Cong ty Co phan DRH Holdings,DRH - Cong ty Co phan DRH Holdings
DRL,Cong ty Co phan Thuy dien - Dien luc 3,DRL - Cong ty Co phan Thuy dien - Dien luc 3
DSN,Cong ty Co phan Cong vien nuoc Dam Sen,DSN - Cong ty Co phan Cong vien nuoc Dam Sen
DST,Cong ty Co phan Dau tu Sao Thang Long,DST - Cong ty Co phan Dau tu Sao Thang Long
DSV,Cong ty Co phan Duong sat Vinh Phu,DSV - Cong ty Co phan Duong sat Vinh Phu
DTA,Cong ty Co phan De Tam,DTA - Cong ty Co phan De Tam
BDT,Cong ty Co phan Xay lap va Vat lieu xay dung Dong Thap,BDT - Cong ty Co phan Xay lap va Vat lieu xay dung Dong Thap
DTC,Cong ty Co phan Viglacera Dong Trieu,DTC - Cong ty Co phan Viglacera Dong Trieu
DTE,Cong ty Co phan Dau tu Nang luong Dai Truong Thanh Holdings,DTE - Cong ty Co phan Dau tu Nang luong Dai Truong Thanh Holdings
DTI,Cong ty Co phan Dau tu Duc Trung,DTI - Cong ty Co phan Dau tu Duc Trung
DTL,Cong ty Co phan Dai Thien Loc,DTL - Cong ty Co phan Dai Thien Loc
DTN,Cong ty Co phan Diem Thong Nhat,DTN - Cong ty Co phan Diem Thong Nhat
DTT,Cong ty Co phan Ky nghe Do Thanh,DTT - Cong ty Co phan Ky nghe Do Thanh
DTV,Cong ty Co phan Phat trien dien Tra Vinh,DTV - Cong ty Co phan Phat trien dien Tra Vinh
MTV,Cong ty Co phan Dich vu Moi truong va Cong trinh Do thi Vung Tau,MTV - Cong ty Co phan Dich vu Moi truong va Cong trinh Do thi Vung Tau
MGG,Tong Cong ty Duc Giang - Cong ty Co phan,MGG - Tong Cong ty Duc Giang - Cong ty Co phan
DVC,Cong ty Co phan Thuong mai dich vu Tong Hop Cang Hai Phong,DVC - Cong ty Co phan Thuong mai dich vu Tong Hop Cang Hai Phong
DVG,Cong ty Co phan Tap doan Son Dai Viet,DVG - Cong ty Co phan Tap doan Son Dai Viet
DVP,Cong ty Co phan Dau tu va Phat trien Cang Dinh Vu,DVP - Cong ty Co phan Dau tu va Phat trien Cang Dinh Vu
DSG,Cong ty Co phan Kinh Dap Cau,DSG - Cong ty Co phan Kinh Dap Cau
DVW,Cong ty Co phan Dich vu va Xay dung cap nuoc Dong Nai,DVW - Cong ty Co phan Dich vu va Xay dung cap nuoc Dong Nai
DXG,Cong ty Co phan Tap doan Dat Xanh,DXG - Cong ty Co phan Tap doan Dat Xanh
DXL,Cong ty Co phan Du lich va Xuat nhap khau Lang Son,DXL - Cong ty Co phan Du lich va Xuat nhap khau Lang Son
DXP,Cong ty Co phan Cang Doan Xa,DXP - Cong ty Co phan Cang Doan Xa
DXS,Cong ty Co phan Dich vu Bat dong san Dat Xanh,DXS - Cong ty Co phan Dich vu Bat dong san Dat Xanh
DXV,Cong ty Co phan VICEM Vat lieu Xay dung Da Nang,DXV - Cong ty Co phan VICEM Vat lieu Xay dung Da Nang
DZM,Cong ty Co phan Co dien Dzi An,DZM - Cong ty Co phan Co dien Dzi An
FUESSV50,Quy ETF SSIAM VNX50,FUESSV50 - Quy ETF SSIAM VNX50
E1VFVN30,Quy ETF DCVFMVN30,E1VFVN30 - Quy ETF DCVFMVN30
EBS,Cong ty Co phan Sach Giao duc tai Thanh pho Ha Noi,EBS - Cong ty Co phan Sach Giao duc tai Thanh pho Ha Noi
E29,Cong ty co phan Dau tu Xay dung va Ky thuat 29,E29 - Cong ty co phan Dau tu Xay dung va Ky thuat 29
ECI,Cong ty Co phan Tap doan ECI,ECI - Cong ty Co phan Tap doan ECI
EFI,Cong ty Co phan Dau tu Tai chinh Giao duc,EFI - Cong ty Co phan Dau tu Tai chinh Giao duc
EIB,Ngan hang Thuong mai Co phan Xuat nhap khau Viet Nam,EIB - Ngan hang Thuong mai Co phan Xuat nhap khau Viet Nam
EID,Cong ty Co phan Dau tu va Phat trien Giao duc Ha Noi,EID - Cong ty Co phan Dau tu va Phat trien Giao duc Ha Noi
ELC,Cong ty Co phan Cong nghe - Vien thong ELCOM,ELC - Cong ty Co phan Cong nghe - Vien thong ELCOM
EMC,Cong ty Co phan Co dien Thu Duc,EMC - Cong ty Co phan Co dien Thu Duc
EME,Cong ty Co phan Dien Co,EME - Cong ty Co phan Dien Co
EMG,Cong ty Co phan Thiet bi Phu tung Co dien,EMG - Cong ty Co phan Thiet bi Phu tung Co dien
EMS,Tong Cong ty Chuyen phat nhanh Buu dien - Cong ty Co phan,EMS - Tong Cong ty Chuyen phat nhanh Buu dien - Cong ty Co phan
EPC,Cong ty Co phan Ca Phe Ea Pok,EPC - Cong ty Co phan Ca Phe Ea Pok
FUESSVFL,Quy ETF SSIAM VNFIN LEAD,FUESSVFL - Quy ETF SSIAM VNFIN LEAD
EVE,Cong ty Co phan Everpia,EVE - Cong ty Co phan Everpia
EVG,Cong ty Co phan Tap doan Everland,EVG - Cong ty Co phan Tap doan Everland
EVF,Cong ty Tai chinh Co phan Dien Luc,EVF - Cong ty Tai chinh Co phan Dien Luc
EIC,Cong ty Co phan EVN Quoc Te,EIC - Cong ty Co phan EVN Quoc Te
LEC,Cong ty Co phan Bat dong san Dien luc Mien Trung,LEC - Cong ty Co phan Bat dong san Dien luc Mien Trung
FHS,Cong ty Co phan Phat hanh sach Thanh pho Ho Chi Minh - FAHASA,FHS - Cong ty Co phan Phat hanh sach Thanh pho Ho Chi Minh - FAHASA
ROS,Cong ty Co phan Xay dung FLC FAROS,ROS - Cong ty Co phan Xay dung FLC FAROS
FBA,Cong ty Co phan Tap doan Quoc te FBA,FBA - Cong ty Co phan Tap doan Quoc te FBA
FCM,Cong ty Co phan Khoang san FECON,FCM - Cong ty Co phan Khoang san FECON
FCN,Cong ty Co phan FECON,FCN - Cong ty Co phan FECON
FDC,Cong ty Co phan Ngoai thuong va Phat trien Dau tu Thanh pho Ho Chi Minh,FDC - Cong ty Co phan Ngoai thuong va Phat trien Dau tu Thanh pho Ho Chi Minh
FIC,Tong Cong ty Vat lieu Xay dung so 1 - Cong ty Co phan,FIC - Tong Cong ty Vat lieu Xay dung so 1 - Cong ty Co phan
FID,Cong ty Co phan Dau tu va Phat trien Doanh nghiep Viet Nam,FID - Cong ty Co phan Dau tu va Phat trien Doanh nghiep Viet Nam
FIR,Cong ty Co phan Dia oc First Real,FIR - Cong ty Co phan Dia oc First Real
FSO,Cong ty Co phan Co khi dong tau thuy san Viet Nam,FSO - Cong ty Co phan Co khi dong tau thuy san Viet Nam
FIT,Cong ty Co phan Tap doan F.I.T,FIT - Cong ty Co phan Tap doan F.I.T
FLC,Cong ty Co phan Tap doan FLC,FLC - Cong ty Co phan Tap doan FLC
ART,Cong ty Co phan Chung khoan BOS,ART - Cong ty Co phan Chung khoan BOS
FMC,Cong ty Co phan Thuc pham Sao Ta,FMC - Cong ty Co phan Thuc pham Sao Ta
FOC,Cong ty Co phan Dich vu Truc tuyen FPT,FOC - Cong ty Co phan Dich vu Truc tuyen FPT
FBC,Cong ty Co phan Co khi Pho Yen,FBC - Cong ty Co phan Co khi Pho Yen
FCS,Cong ty Co phan Luong thuc Thanh pho Ho Chi Minh,FCS - Cong ty Co phan Luong thuc Thanh pho Ho Chi Minh
FRM,Cong ty Co phan Lam nghiep Sai Gon,FRM - Cong ty Co phan Lam nghiep Sai Gon
DP3,Cong ty Co Phan Duoc Pham Trung Uong 3,DP3 - Cong ty Co Phan Duoc Pham Trung Uong 3
FTM,Cong ty Co phan Dau tu va Phat trien Duc Quan,FTM - Cong ty Co phan Dau tu va Phat trien Duc Quan
FPT,Cong ty Co phan FPT,FPT - Cong ty Co phan FPT
FRT,Cong ty Co phan Ban le Ky thuat so FPT,FRT - Cong ty Co phan Ban le Ky thuat so FPT
FTS,Cong ty Co phan Chung khoan FPT,FTS - Cong ty Co phan Chung khoan FPT
FRC,Cong ty Co phan Lam dac san xuat khau Quang Nam,FRC - Cong ty Co phan Lam dac san xuat khau Quang Nam
FT1,Cong ty Co phan Phu tung may so 1,FT1 - Cong ty Co phan Phu tung may so 1
FOX,Cong ty Co phan Vien thong FPT,FOX - Cong ty Co phan Vien thong FPT
FTI,Cong ty Co phan Cong nghiep - Thuong mai Huu Nghi,FTI - Cong ty Co phan Cong nghiep - Thuong mai Huu Nghi
FUEMAV30,Quy ETF MAFM VN30,FUEMAV30 - Quy ETF MAFM VN30
FUESSV30,Quy ETF SSIAM VN30,FUESSV30 - Quy ETF SSIAM VN30
FUEVFVND,Quy ETF DCVFMVN DIAMOND,FUEVFVND - Quy ETF DCVFMVN DIAMOND
FUEVN100,Quy ETF VINACAPITAL VN100,FUEVN100 - Quy ETF VINACAPITAL VN100
G20,Cong ty Co phan Dau tu Det may Vinh Phuc,G20 - Cong ty Co phan Dau tu Det may Vinh Phuc
GAB,Cong ty Co phan Dau tu Khai khoang & Quan ly Tai san FLC,GAB - Cong ty Co phan Dau tu Khai khoang & Quan ly Tai san FLC
M10,Tong cong ty May 10 - Cong ty Co phan,M10 - Tong cong ty May 10 - Cong ty Co phan
GAS,Tong Cong ty Khi Viet Nam - Cong ty Co phan,GAS - Tong Cong ty Khi Viet Nam - Cong ty Co phan
BVB,Ngan hang Thuong mai Co phan Ban Viet,BVB - Ngan hang Thuong mai Co phan Ban Viet
GDT,Cong ty Co phan Che bien Go Duc Thanh,GDT - Cong ty Co phan Che bien Go Duc Thanh
GDW,Cong ty Co phan Cap nuoc Gia Dinh,GDW - Cong ty Co phan Cap nuoc Gia Dinh
GEX,Cong ty Co phan Tap doan Gelex,GEX - Cong ty Co phan Tap doan Gelex
GEE,Cong ty Co phan Dien luc Gelex,GEE - Cong ty Co phan Dien luc Gelex
PGV,Tong Cong ty Phat dien 3 - Cong ty Co phan,PGV - Tong Cong ty Phat dien 3 - Cong ty Co phan
GER,Cong ty Co phan The thao Ngoi sao Geru,GER - Cong ty Co phan The thao Ngoi sao Geru
GGG,Cong ty Co phan O to Giai Phong,GGG - Cong ty Co phan O to Giai Phong
GHC,Cong ty Co phan Thuy dien Gia Lai,GHC - Cong ty Co phan Thuy dien Gia Lai
FGL,Cong ty Co phan Ca phe Gia Lai,FGL - Cong ty Co phan Ca phe Gia Lai
GLW,Cong ty Co phan Cap thoat nuoc Gia Lai,GLW - Cong ty Co phan Cap thoat nuoc Gia Lai
GIL,Cong ty Co phan San xuat Kinh doanh Xuat nhap khau Binh Thanh,GIL - Cong ty Co phan San xuat Kinh doanh Xuat nhap khau Binh Thanh
GLC,Cong ty Co phan Vang Lao Cai,GLC - Cong ty Co phan Vang Lao Cai
GEG,Cong ty Co phan Dien Gia Lai,GEG - Cong ty Co phan Dien Gia Lai
GLT,Cong ty Co phan Ky thuat dien Toan Cau,GLT - Cong ty Co phan Ky thuat dien Toan Cau
GMA,Cong ty Co phan G-Automobile,GMA - Cong ty Co phan G-Automobile
GMC,Cong ty Co phan Garmex Sai Gon,GMC - Cong ty Co phan Garmex Sai Gon
GMD,Cong ty Co phan Gemadept,GMD - Cong ty Co phan Gemadept
GMX,Cong ty Co phan Gach ngoi Gom xay dung My Xuan,GMX - Cong ty Co phan Gach ngoi Gom xay dung My Xuan
GIC,Cong ty Co phan Dau tu Dich vu va Phat trien Xanh,GIC - Cong ty Co phan Dau tu Dich vu va Phat trien Xanh
GSM,Cong ty Co phan Thuy dien Huong Son,GSM - Cong ty Co phan Thuy dien Huong Son
GSP,Cong ty Co phan Van tai San pham Khi Quoc te,GSP - Cong ty Co phan Van tai San pham Khi Quoc te
C36,Cong ty Co phan Quan ly va Xay dung Cong trinh Giao thong 236,C36 - Cong ty Co phan Quan ly va Xay dung Cong trinh Giao thong 236
GTA,Cong ty Co phan Che bien Go Thuan An,GTA - Cong ty Co phan Che bien Go Thuan An
DDH,Cong ty Co phan Dam bao giao thong duong thuy Hai Phong,DDH - Cong ty Co phan Dam bao giao thong duong thuy Hai Phong
GTH,Cong ty Co phan Xay dung Giao thong Thua Thien Hue,GTH - Cong ty Co phan Xay dung Giao thong Thua Thien Hue
GTT,Cong ty Co phan Thuan Thao,GTT - Cong ty Co phan Thuan Thao
H11,Cong ty Co phan Xay dung HUD101,H11 - Cong ty Co phan Xay dung HUD101
PHN,Cong ty Co phan Pin Ha Noi,PHN - Cong ty Co phan Pin Ha Noi
HC1,Cong ty Co phan Xay dung so 1 Ha Noi,HC1 - Cong ty Co phan Xay dung so 1 Ha Noi
HCB,Cong ty Co phan Det may 29/3,HCB - Cong ty Co phan Det may 29/3
HC3,Cong ty Co phan Xay dung so 3 Hai Phong,HC3 - Cong ty Co phan Xay dung so 3 Hai Phong
HAD,Cong ty Co phan Bia Ha Noi - Hai Duong,HAD - Cong ty Co phan Bia Ha Noi - Hai Duong
HDP,Cong ty Co phan Duoc Ha Tinh,HDP - Cong ty Co phan Duoc Ha Tinh
HAG,Cong ty Co phan Hoang Anh Gia Lai,HAG - Cong ty Co phan Hoang Anh Gia Lai
HAH,Cong ty Co phan Van tai va Xep do Hai An,HAH - Cong ty Co phan Van tai va Xep do Hai An
HAI,Cong ty Co phan Nong duoc HAI,HAI - Cong ty Co phan Nong duoc HAI
HPX,Cong ty Co phan Dau tu Hai Phat,HPX - Cong ty Co phan Dau tu Hai Phat
HID,Cong ty Co phan Halcom Vietnam,HID - Cong ty Co phan Halcom Vietnam
HNR,Cong ty Co phan Ruou va Nuoc Giai Khat Ha Noi,HNR - Cong ty Co phan Ruou va Nuoc Giai Khat Ha Noi
HLB,Cong ty Co phan Bia va Nuoc giai khat Ha Long,HLB - Cong ty Co phan Bia va Nuoc giai khat Ha Long
HLT,Cong ty Co phan Det may Hoang Thi Loan,HLT - Cong ty Co phan Det may Hoang Thi Loan
HAM,Cong ty Co phan Vat tu Hau Giang,HAM - Cong ty Co phan Vat tu Hau Giang
HHV,Cong ty Co phan Dau tu Ha tang Giao thong Deo Ca,HHV - Cong ty Co phan Dau tu Ha tang Giao thong Deo Ca
AAS,Cong ty Co phan Chung khoan SmartInvest,AAS - Cong ty Co phan Chung khoan SmartInvest
BBM,Cong ty Co phan Bia Ha Noi - Nam Dinh,BBM - Cong ty Co phan Bia Ha Noi - Nam Dinh
HAN,Tong Cong ty Xay dung Ha Noi - CTCP,HAN - Tong Cong ty Xay dung Ha Noi - CTCP
HD6,Cong ty Co phan Dau tu va Phat trien nha so 6 Ha Noi,HD6 - Cong ty Co phan Dau tu va Phat trien nha so 6 Ha Noi
HNP,Cong ty Co phan Hanel Xop Nhua,HNP - Cong ty Co phan Hanel Xop Nhua
HSM,Tong Cong ty Co phan Det May Ha Noi,HSM - Tong Cong ty Co phan Det May Ha Noi
HAP,Cong ty Co phan Tap Doan Hapaco,HAP - Cong ty Co phan Tap Doan Hapaco
HTM,Tong Cong ty Thuong mai Ha Noi – Cong ty co ph,HTM - Tong Cong ty Thuong mai Ha Noi – Cong ty co ph
HAR,Cong ty Co phan Dau tu Thuong mai Bat dong san An Duong Thao Dien,HAR - Cong ty Co phan Dau tu Thuong mai Bat dong san An Duong Thao Dien
HAS,Cong ty Co phan Hacisco,HAS - Cong ty Co phan Hacisco
HES,Cong ty Co phan Dich vu Giai tri Ha Noi,HES - Cong ty Co phan Dich vu Giai tri Ha Noi
HAT,Cong ty Co phan Thuong mai Bia Ha Noi,HAT - Cong ty Co phan Thuong mai Bia Ha Noi
GH3,Cong ty Co phan Cong trinh giao thong Ha Noi,GH3 - Cong ty Co phan Cong trinh giao thong Ha Noi
HAV,Cong ty Co phan Ruou Hapro,HAV - Cong ty Co phan Ruou Hapro
HGW,Cong ty Co phan Cap thoat nuoc - Cong trinh Do thi Hau Giang,HGW - Cong ty Co phan Cap thoat nuoc - Cong trinh Do thi Hau Giang
HTW,Cong ty Co phan Cap nuoc Ha Tinh,HTW - Cong ty Co phan Cap nuoc Ha Tinh
HAX,Cong ty Co phan Dich vu O to Hang Xanh,HAX - Cong ty Co phan Dich vu O to Hang Xanh
HBC,Cong ty Co phan Tap doan Xay dung Hoa Binh,HBC - Cong ty Co phan Tap doan Xay dung Hoa Binh
HBD,Cong ty Co phan Bao bi PP Binh Duong,HBD - Cong ty Co phan Bao bi PP Binh Duong
HBH,Cong ty Co phan HABECO - Hai Phong,HBH - Cong ty Co phan HABECO - Hai Phong
HBS,Cong ty Co phan Chung khoan Hoa Binh,HBS - Cong ty Co phan Chung khoan Hoa Binh
HCC,Cong ty Co phan Be tong Hoa Cam - Intimex,HCC - Cong ty Co phan Be tong Hoa Cam - Intimex
XDH,Cong ty Co phan Dau tu Xay dung Dan dung Ha Noi,XDH - Cong ty Co phan Dau tu Xay dung Dan dung Ha Noi
HCD,Cong ty Co phan Dau tu San xuat va Thuong mai HCD,HCD - Cong ty Co phan Dau tu San xuat va Thuong mai HCD
HCI,Cong ty Co phan Dau tu - Xay dung Ha Noi,HCI - Cong ty Co phan Dau tu - Xay dung Ha Noi
HCM,Cong ty Co phan Chung khoan Thanh pho Ho Chi Minh,HCM - Cong ty Co phan Chung khoan Thanh pho Ho Chi Minh
HTE,Cong ty Co phan Dau tu Kinh doanh Dien luc Thanh pho Ho Chi Minh,HTE - Cong ty Co phan Dau tu Kinh doanh Dien luc Thanh pho Ho Chi Minh
HCT,Cong ty Co phan Thuong mai - Dich vu - Van tai Xi mang Hai Phong,HCT - Cong ty Co phan Thuong mai - Dich vu - Van tai Xi mang Hai Phong
HDA,Cong ty Co phan Hang son Dong a,HDA - Cong ty Co phan Hang son Dong a
HDB,Ngan hang Thuong mai Co phan Phat Trien Thanh pho Ho Chi Minh,HDB - Ngan hang Thuong mai Co phan Phat Trien Thanh pho Ho Chi Minh
HDC,Cong ty Co phan Phat trien Nha Ba Ria Vung Tau,HDC - Cong ty Co phan Phat trien Nha Ba Ria Vung Tau
HDG,Cong ty Co phan Tap doan Ha Do,HDG - Cong ty Co phan Tap doan Ha Do
HDM,Cong ty Co phan Det May Hue,HDM - Cong ty Co phan Det May Hue
HDO,Cong ty Co phan Hung Dao Container,HDO - Cong ty Co phan Hung Dao Container
DHD,Cong ty Co phan Duoc Vat Tu Y Te Hai Duong,DHD - Cong ty Co phan Duoc Vat Tu Y Te Hai Duong
HDW,Cong ty Co phan Kinh doanh Nuoc sach Hai Duong,HDW - Cong ty Co phan Kinh doanh Nuoc sach Hai Duong
HEC,Cong ty Co phan Tu van xay dung Thuy Loi II,HEC - Cong ty Co phan Tu van xay dung Thuy Loi II
HEJ,Tong Cong ty Tu van Xay dung Thuy Loi Viet Nam - CTCP,HEJ - Tong Cong ty Tu van Xay dung Thuy Loi Viet Nam - CTCP
HEM,Cong ty Co phan Che tao Dien co Ha Noi,HEM - Cong ty Co phan Che tao Dien co Ha Noi
HEP,Cong ty Co phan Moi truong va Cong trinh do thi Hue,HEP - Cong ty Co phan Moi truong va Cong trinh do thi Hue
HEV,Cong ty Co phan Sach Dai hoc - Day nghe,HEV - Cong ty Co phan Sach Dai hoc - Day nghe
HFC,Cong ty Co phan Xang dau HFC,HFC - Cong ty Co phan Xang dau HFC
HFX,Cong ty Co phan San xuat - Xuat nhap khau Thanh Ha,HFX - Cong ty Co phan San xuat - Xuat nhap khau Thanh Ha
HGM,Cong ty Co phan Co khi va Khoang san Ha Giang,HGM - Cong ty Co phan Co khi va Khoang san Ha Giang
HGT,Cong ty Co phan Du lich Huong Giang,HGT - Cong ty Co phan Du lich Huong Giang
HHC,Cong ty Co phan Banh keo Hai Ha,HHC - Cong ty Co phan Banh keo Hai Ha
HHG,Cong ty Co phan Hoang Ha,HHG - Cong ty Co phan Hoang Ha
HHN,Cong ty Co phan Van tai va Dich vu Hang hoa Ha Noi,HHN - Cong ty Co phan Van tai va Dich vu Hang hoa Ha Noi
HHP,Cong ty Co phan Giay Hoang Ha Hai Phong,HHP - Cong ty Co phan Giay Hoang Ha Hai Phong
HHR,Cong ty Co phan Duong sat Ha Hai,HHR - Cong ty Co phan Duong sat Ha Hai
HHS,Cong ty Co phan Dau tu Dich vu Hoang Huy,HHS - Cong ty Co phan Dau tu Dich vu Hoang Huy
TCH,Cong ty Co phan Dau tu Dich vu Tai chinh Hoang Huy,TCH - Cong ty Co phan Dau tu Dich vu Tai chinh Hoang Huy
HSL,Cong ty Co phan Dau tu Phat trien Thuc pham Hong Ha,HSL - Cong ty Co phan Dau tu Phat trien Thuc pham Hong Ha
HIG,Cong ty Co phan Tap Doan HIPT,HIG - Cong ty Co phan Tap Doan HIPT
HPI,Cong ty Co phan Khu cong nghiep Hiep Phuoc,HPI - Cong ty Co phan Khu cong nghiep Hiep Phuoc
HIZ,Cong ty Co phan Khu cong nghiep Ho Nai,HIZ - Cong ty Co phan Khu cong nghiep Ho Nai
HJS,Cong ty Co phan Thuy dien Nam Mu,HJS - Cong ty Co phan Thuy dien Nam Mu
HKB,Cong ty Co phan Nong nghiep va Thuc pham Ha Noi - Kinh Bac,HKB - Cong ty Co phan Nong nghiep va Thuc pham Ha Noi - Kinh Bac
HKP,Cong ty Co phan Bao bi Ha Tien,HKP - Cong ty Co phan Bao bi Ha Tien
HKT,Cong ty Co phan Dau tu Ego Viet Nam,HKT - Cong ty Co phan Dau tu Ego Viet Nam
HLA,Cong ty Co phan Huu Lien a Chau,HLA - Cong ty Co phan Huu Lien a Chau
HLC,Cong ty Co phan Than Ha Lam - Vinacomin,HLC - Cong ty Co phan Than Ha Lam - Vinacomin
HLD,Cong ty Co phan Dau tu va Phat trien Bat dong san HUDLAND,HLD - Cong ty Co phan Dau tu va Phat trien Bat dong san HUDLAND
HLG,Cong ty Co phan Tap doan Hoang Long,HLG - Cong ty Co phan Tap doan Hoang Long
